Title,Text,Time,Url
Нефть под давлением на фоне сигналов от Китая и ФРС,"© Reuters.
Investing.com — Цены на нефть умеренно снизились в пятницу после двух дней восстановления, завершая неделю в солидном минусе, пишет Reuters.Reuters. 
Давление на рынок продолжает оказывать беспокойство по поводу спроса в Китае и замедления темпов снижения ставки ФРС.
Фьючерсы на Brent упали 0,36% до $72,30 за баррель 16:24 мск. Контракты на WTI снизились 0,26% до $68,51. За неделю Brent упадет на 3%, а WTI — почти на 4%.Brent упали 0,36% до $72,30 за баррель 16:24 мск. Контракты на WTI снизились 0,26% до $68,51. За неделю Brent упадет на 3%, а WTI — почти на 4%. 
Китайские нефтеперерабатывающие предприятия в октябре переработали на 4,6% меньше нефти, чем годом ранее, из-за закрытия заводов и снижения операционных показателей на небольших независимых НПЗ, показали данные Национального бюро статистики в пятницу.
Между тем, рост производства на заводах Китая замедлился в прошлом месяце, а проблемы со спросом в секторе недвижимости не проявили признаков ослабления, что усилило опасения инвесторов по поводу экономического здоровья крупнейшего в мире импортера нефти.не проявили признаков ослабления , что усилило опасения инвесторов по поводу экономического здоровья крупнейшего в мире импортера нефти. 
«Китай своевременно напомнил об истинном состоянии своего нефтяного сектора. В октябре пропускная способность нефтеперерабатывающих заводов страны снизилась седьмой месяц подряд», — сказал аналитик PVM Тамаш Варга.
«Китай своевременно напомнил об истинном состоянии своего нефтяного сектора. В октябре пропускная способность нефтеперерабатывающих заводов страны снизилась седьмой месяц подряд», — сказал аналитик PVM Тамаш Варга.
Тем временем на выступлении в четверг председатель ФРС Джером Пауэлл заявил, что американскому центробанку не нужно спешить со снижением процентных ставок.
Замедление ожидаемого снижения процентных ставок может привести к охлаждению экономического роста, что ограничит спрос на топливо.заявил , что американскому центробанку не нужно спешить со снижением процентных ставок. Замедление ожидаемого снижения процентных ставок может привести к охлаждению экономического роста, что ограничит спрос на топливо. 
Цены на нефть также упали на этой неделе, так как основные прогнозисты указали на замедление роста мирового спроса.
МЭА прогнозирует превышение мирового предложения нефти над спросом более чем на 1 млн баррелей в день в 2025 году даже при условии сохранения сокращений добычи ОПЕК+. ОПЕК также снизила прогноз роста мирового спроса на нефть в этом году и 2025 году.прогнозирует превышение мирового предложения нефти над спросом более чем на 1 млн баррелей в день в 2025 году даже при условии сохранения сокращений добычи ОПЕК+. ОПЕК также снизила прогноз роста мирового спроса на нефть в этом году и 2025 году. 
По данным Управления энергетической информации (EIA), запасы бензина в США на прошлой неделе упали на 4,4 миллиона баррелей до самого низкого уровня с ноября 2022 года, что перевесило рост запасов сырой нефти на 2,1 миллиона баррелей.","15.11.2024, 16:31",https://ru.investing.com/news/commodities-news/article-2573266
ОПЕК ухудшила прогноз спроса на нефть четвертый месяц подряд,"© Reuters.
Investing.com — ОПЕК четвертый месяц подряд снижает прогнозы роста мирового спроса на нефть в этом и следующем году, запоздало признав замедление темпов роста основного потребителя — Китая. Об этом пишет Bloomberg.нефть в этом и следующем году, запоздало признав замедление темпов роста основного потребителя — Китая. Об этом Bloomberg. 
Мировое потребление нефти увеличится на 1,8 миллиона баррелей в день — чуть менее чем на 2% — в 2024 году, говорится в ежемесячном отчете Организации стран-экспортеров нефти. Это на 107 000 баррелей в день меньше, чем прогнозировалось ранее, после того как данные из таких азиатских стран, как Китай и Индия, а также из Африки, оказались ниже ожиданий, говорится в докладе.
С июля ОПЕК сократила прогнозы роста спроса на нефть в этом году почти на пятую часть в соответствии с резким снижением цен на сырую нефть. Однако прогноз картеля остается значительно более оптимистичным, чем у других прогнозистов — банков и торговых домов с Уолл-стрит и даже нефтяной компании Саудовской Аравии Aramco. Это примерно вдвое больше, чем прогнозирует Международное энергетическое агентство.Aramco . Это примерно вдвое больше, чем прогнозирует Международное энергетическое агентство. 
Члены группы демонстрируют недоверие к прогнозам базирующегося в Вене секретариата. Возглавляемая Саудовской Аравией, ОПЕК и ее союзники дважды откладывали возобновление добычи, приостановленной с 2022 года. Серия скромных ежемесячных увеличений должна начаться в начале следующего года и будет рассмотрена на заседании 1 декабря.дважды откладывали возобновление добычи, приостановленной с 2022 года. Серия скромных ежемесячных увеличений должна начаться в начале следующего года и будет рассмотрена на заседании 1 декабря. 
С начала июля международные фьючерсы на сырую нефть упали примерно на 18%, поскольку трейдеры все больше уверены, что конфликт на Ближнем Востоке не нарушит экспорт региона. Вместо этого они сосредоточились на замедлении темпов роста в Китае, где спрос сокращается уже несколько месяцев подряд, поскольку Пекин борется с целым рядом экономических проблем.нефть упали примерно на 18%, поскольку трейдеры все больше уверены, что конфликт на Ближнем Востоке не нарушит экспорт региона. Вместо этого они сосредоточились на замедлении темпов роста в Китае, где спрос сокращается уже несколько месяцев подряд, поскольку Пекин борется с целым рядом экономических проблем. 
Перспективы могут пошатнуться после прихода к власти избранного президента Дональда Трампа, который пригрозил ввести жесткие торговые тарифы против Китая и других стран. Во время своего предыдущего срока Трамп подавил экспорт нефти из Ирана, члена ОПЕК, в связи со спором о ядерной программе Тегерана.
Тем временем руководство ОПЕК+ может утешиться улучшением показателей некоторых членов, которые отстают в реализации мер по сокращению добычи.
Согласно отчету, Казахстан в октябре сократил добычу на 292 000 баррелей в день до 1,29 миллиона в день. Это ниже его квоты, что означает, что страна начала выполнять дополнительные ограничения, которые она обещала ввести в качестве компенсации за предыдущее перепроизводство. Сокращение может быть просто отражением временного технического обслуживания на гигантском нефтяном месторождении Кашаган.
Ирак также постепенно снижает квоту, согласованную в начале года, но при этом продолжает качать больше, чем нужно, и не показывает признаков компенсации за предыдущее перепроизводство. В октябре он сократил суточную добычу на 66 000 баррелей до 4,068 млн баррелей, что все еще немного выше целевого показателя в 4 млн баррелей. Россия осталась немного выше своего согласованного потолка, говорится в отчете.
ОПЕК прогнозирует, что мировое потребление нефти в этом году составит в среднем 104 миллиона баррелей в день. В 2025 году суточный спрос увеличится еще на 1,5 миллиона баррелей, что на 103 000 баррелей меньше, чем организация прогнозировала ранее.
МЭА опубликует свою последнюю ежемесячную оценку состояния мировых нефтяных рынков в четверг. По его прогнозам, рост спроса будет замедляться по мере того, как мир будет переходить от ископаемого топлива на электромобили в попытке предотвратить катастрофические изменения климата.","12.11.2024, 15:45",https://ru.investing.com/news/commodities-news/article-2567775
Нефть обновляет минимумы ноября по 3 причинам,"© Reuters.
Investing.com — Нефть продолжает самое масштабное падение за две недели из-за слабого прогноза спроса в Китае, сильного доллара США и опасений, что рынок может перейти к избыточному предложению, пишет Bloomberg.
Январские фьючерсы на Brent торговались ниже $72 долларов после падения почти на 3% в понедельник. По состоянию на 09:01 мск. контракты расположились на уровне $71,63 за баррель, теряя почти 0,3%. Ранее цены отметили ноябрьский минимум $71,56. WTI торговалась на $67,78, с понижением на 0,37%.Brent торговались ниже $72 долларов после падения почти на 3% в понедельник. По состоянию на 09:01 мск. контракты расположились на уровне $71,63 за баррель, теряя почти 0,3%. Ранее цены отметили ноябрьский минимум $71,56. WTI торговалась на $67,78, с понижением на 0,37%. 
Последние меры Китая по стимулированию своей экономики не дотягивают до ожиданий инвесторов, а инфляция остается слабой.
Индекс доллара достиг новых многомесячных максимумов, поскольку инвесторы корректирубт позиции после победы Дональда Трампа, что делает нефть более дорогой для большинства покупателей.Индекс доллара достиг новых многомесячных максимумов, поскольку инвесторы корректирубт позиции после победы Дональда Трампа, что делает нефть более дорогой для большинства покупателей. 
Сырая нефть торговалась в относительно узком диапазоне с середины прошлого месяца, поскольку трейдеры отслеживали напряженность на Ближнем Востоке, гонку за Белый дом и решения ОПЕК+ по добыче. Перспективы остаются слабыми: ожидается, что в следующем году мировое предложение превысит спрос. Ежемесячный отчет ОПЕК о рынке, который выйдет позднее во вторник, прольет свет на перспективы баланса рынка.
«Настрой на нефтяном рынке остается в основном медвежьим: укрепление доллара США, опасения по поводу спроса и ожидания ослабления баланса нефти оказывают давление на цены», — сказал Уоррен Паттерсон, глава отдела стратегии по сырьевым товарам ING Groep NV. «Чтобы изменить прогноз на следующий год, нам либо нужно увидеть, что ОПЕК+ отложит возврат баррелей на большую часть 2025 года, либо что США эффективно введут санкции против Ирана».
«Настрой на нефтяном рынке остается в основном медвежьим: укрепление доллара США, опасения по поводу спроса и ожидания ослабления баланса нефти оказывают давление на цены», — сказал Уоррен Паттерсон, глава отдела стратегии по сырьевым товарам ING Groep NV. «Чтобы изменить прогноз на следующий год, нам либо нужно увидеть, что ОПЕК+ отложит возврат баррелей на большую часть 2025 года, либо что США эффективно введут санкции против Ирана».","12.11.2024, 09:10",https://ru.investing.com/news/commodities-news/article-2567152
НОВАТЭКу и «Сургутнефтегазу» разрешили ограничить раскрытие данных,"© Reuters
Investing.com — Компании «Сургутнефтегаз», НОВАТЭК, «Ямал СПГ» и «Арктик СПГ — 2» смогут самостоятельно определять объем раскрываемой ими информации. Об этом говорится в указе президента России Владимира Путина № 965 от 11 ноября. Указ вступает в силу со дня публикации.«Сургутнефтегаз» , НОВАТЭК , «Ямал СПГ» и «Арктик СПГ — 2» смогут самостоятельно определять объем раскрываемой ими информации. Об этом говорится в президента России Владимира Путина № 965 от 11 ноября. Указ вступает в силу со дня публикации. 
В ноябре 2023 года президент России Владимир Путин подписал указ с перечнем из 46 компаний, которым дается право самостоятельно определять состав и объем информации, подлежащей раскрытию. Указ был подписан в связи с необходимостью «принятия безотлагательных мер в ответ на недружественные и противоречащие международному праву действия» США и других государств.
В определенный указом перечень компаний, среди прочих тогда вошли «Роснефть» и ряд ее дочерних предприятий, в том числе «Башнефть». Нераскрытую информацию компании должны были направлять в ЦБ.«Роснефть» и ряд ее дочерних предприятий, в том числе «Башнефть» . Нераскрытую информацию компании должны были направлять в ЦБ.","11.11.2024, 16:35",https://ru.investing.com/news/general-news/article-2566522
Нефть упала на ухудшении перспектив спроса,"© Reuters.
Investing.com — Нефть продолжает свое самое масштабное падение почти за две недели на фоне ухудшения прогнозов спроса со стороны Китая, главного импортера черного золота. Об этом пишет Yahoo Finance.Yahoo Finance. 
По состоянию на 13:55 мск. фьючерсы на Brent торговались на $72,82 за баррель, с понижением на 1,42%, потеряв более 2% в пятницу. WTI упала на 1,61% до $69,25.Brent торговались на $72,82 за баррель, с понижением на 1,42%, потеряв более 2% в пятницу. WTI упала на 1,61% до $69,25. 
Данные, опубликованные в выходные, показали низкую потребительскую инфляцию в Китае в октябре, в то время как цены производителей снова упали.потребительскую инфляцию в Китае в октябре, в то время как цены производителей снова упали. 
После переизбрания президента Трампа на прошлой неделе доллар еще больше укрепился, что усилило давление на сырьевые рынки.доллар еще больше укрепился , что усилило давление на сырьевые рынки. 
Трейдеры оценивают перспективы мирового спроса до 2025 года, а также последствия избрания Дональда Трампа, включая рост курса доллара и напряженность в отношениях между Израилем и Ираном.
«Возобновление ралли доллара, которое временно приостановилось в пятницу, привело к негативным настроениям среди сырьевых товаров сегодня утром», — сказал Оле Хансен, глава отдела стратегии сырьевых товаров в Saxo Bank. «Вера рынка в инициативы по поддержке цен в Китае сдулась», — добавил он.
«Возобновление ралли доллара, которое временно приостановилось в пятницу, привело к негативным настроениям среди сырьевых товаров сегодня утром», — сказал Оле Хансен, глава отдела стратегии сырьевых товаров в Saxo Bank. «Вера рынка в инициативы по поддержке цен в Китае сдулась», — добавил он.
Инвесторы получат целый ряд влиятельных прогнозов на этой неделе, начиная с публикации от ОПЕК во вторник.
После прогноза от Организации стран-экспортеров нефти Управление энергетической информации США опубликует свой краткосрочный прогноз в среду, а на следующий день — Международное энергетическое агентство. В своем последнем обзоре ОПЕК понизила прогнозы спроса.","11.11.2024, 14:02",https://ru.investing.com/news/commodities-news/article-2566033
