Title,Text,Time,Url
Нефть демонстрирует самый продолжительный рост с июля,"© Reuters.
Investing.com — Нефть нацелилась на третий недельный рост — самый продолжительный с июля — на фоне признаков напряженности на рынке, включая снижение запасов в США, что компенсировало опасения по поводу слабого спроса в крупнейшем импортере, Китае. Об этом пишет Bloomberg.Bloomberg. 
Мировой эталон нефти Brent поднялся выше $77 за баррель и за неделю вырос примерно на 1%, в то время как WTI находилась над $74. Запасы нефти в хранилище в Кушинге, штат Оклахома, упали до самого низкого уровня с 2014 года. Потребительская инфляция в Китае продолжила снижаться, что подчеркивает трудности, с которыми сталкиваются власти в попытках стимулирования экономики.Brent поднялся выше $77 за баррель и за неделю вырос примерно на 1%, в то время как WTI находилась над $74. Запасы нефти в хранилище в Кушинге, штат Оклахома, упали до самого низкого уровня с 2014 года. Потребительская инфляция в Китае продолжила снижаться, что подчеркивает трудности, с которыми сталкиваются власти в попытках стимулирования экономики. 
Затяжное повышение цен на нефть в последние недели поддерживается холодной погодой, которая увеличивает спрос на топливо, сокращением запасов в США и снижением поставок из России. Возвращение избранного президента Дональда Трампа в Белый дом также увеличивает риски для поставок из Ирана и создает напряженность по поводу потенциальной торговой войны, которая может прервать потоки энергоносителей.
«Сокращение запасов, ожидание снижения спроса со стороны Китая на иранский экспорт и похолодание, которое обещает значительное увеличение спроса на топливо для отопления, оправдывают это движение вверх», — говорит Крис Уэстон, глава исследовательского отдела Pepperstone Group. «Однако предложение, которое мы сейчас наблюдаем на уровне 75 долларов, свидетельствуют о справедливости текущих уровней, и существует некая неохота двигаться к $80».
«Сокращение запасов, ожидание снижения спроса со стороны Китая на иранский экспорт и похолодание, которое обещает значительное увеличение спроса на топливо для отопления, оправдывают это движение вверх», — говорит Крис Уэстон, глава исследовательского отдела Pepperstone Group. «Однако предложение, которое мы сейчас наблюдаем на уровне 75 долларов, свидетельствуют о справедливости текущих уровней, и существует некая неохота двигаться к $80».
Ожидается, что Трамп одобрит новое бурение на федеральных землях в рамках потока исполнительных приказов в первые часы после своей инаугурации 20 января. Избранный президент также пообещал ввести тарифы на весь канадский импорт, возможно, включая нефть.
Рыночные показатели указывают на ужесточение условий. Спрэд на поставку нефти Brent — разница между двумя ближайшими контрактами — увеличился до 70 центов за баррель в состоянии бэквордации, что является «бычьей» тенденцией. Месяц назад этот разрыв составлял 29 центов в бэквордации.","10.01.2025, 10:12",https://ru.investing.com/news/commodities-news/article-2618286
Нефть вернулась к росту на фоне сокращения запасов в США,"© Reuters.
Investing.com — Цены на нефть немного выросли после двухдневного снижения на фоне сообщений об ощутимом сокращении запасов коммерческой нефти в США, пишет Bloomberg.Bloomberg. 
К 15:40 мск. Brent торговалась с повышением на 0,68%, в районе $73,69 за баррель, после снижения на 1,8% за предыдущие две сессии. WTI прибавляла 0,23%, расположившись на $70,24.Brent торговалась с повышением на 0,68%, в районе $73,69 за баррель, после снижения на 1,8% за предыдущие две сессии. WTI прибавляла 0,23%, расположившись на $70,24. 
Американский институт нефти сообщил, что запасы в США сократились на 4,7 млн баррелей на прошлой неделе, что будет четвертым подряд снижением, если официальные данные, которые выйдут позднее в среду, подтвердят это.
Цены на нефть колеблются в довольно узком диапазоне последние два месяца, поддерживаемые геополитической напряженностью на Ближнем Востоке и в Европе, а также возможностью введения новых санкций на поставки из Ирана и России.
В противовес выступают слабый спрос из Китая и ожидания значительного производства нефти странами вне ОПЕК+, такими как США, где избранный президент Дональд Трамп обещал поощрять внутреннее развитие отрасли.
«Глобальные запасы нефти, по-видимому, продолжают сокращаться, и, согласно данным API, на прошлой неделе было зафиксировано значительное сокращение запасов нефти в США, что поддерживает цены», — заявил Джованни Стауново, аналитик по товарам в UBS Group AG.
«Глобальные запасы нефти, по-видимому, продолжают сокращаться, и, согласно данным API, на прошлой неделе было зафиксировано значительное сокращение запасов нефти в США, что поддерживает цены», — заявил Джованни Стауново, аналитик по товарам в UBS Group AG.
На ближневосточных рынках также наблюдаются признаки дефицита нефти, где цены на несколько основных сортов выросли, по словам трейдеров. Это помогло резко сократить разницу в цене между азиатским эталоном Dubai и Brent.","18.12.2024, 15:43",https://ru.investing.com/news/commodities-news/article-2604067
Экспорт нефтепродуктов из России сократился после скачка в ноябре,"© Reuters
Investing.com — Экспорт нефтепродуктов из России на прошлой неделе немного снизился из-за уменьшения объемов поставок дизельного топлива, после того как в ноябре наблюдался подъем, связанный с возвращением большего количества нефтеперерабатывающих установок с сезонного обслуживания. Об этом пишет Bloomberg.Bloomberg. 
Средний поток нефтепродуктов за четыре недели составил 2,25 миллиона баррелей в день на неделе до 8 декабря, согласно данным, собранным Bloomberg из аналитической компании Vortexa Ltd. Это на 4,5% ниже уровня предыдущей недели.
Среднее 4-недельное значение потоков нефтепродуктов составило 2,25 млн баррелей в день за неделю по 8 декабря, согласно данным аналитической компании Vortexa Ltd., собранным Bloomberg. Это на 4,5% ниже уровня предыдущей недели.
Завершение пикового осеннего ремонта на НПЗ помогло экспорту достигнуть четырехмесячного максимума в ноябре. На последней неделе поставки сократились на фоне снижения потоков дизельного топлива и сырья для НПЗ. Поставок бензина пока не наблюдалось, несмотря на снятие запрета на экспорт для производителей этого топлива.снятие запрета на экспорт для производителей этого топлива. 
Тем временем нефть в четверг торгуется с минимальными изменениями, находясь под небольшим давлением после 3-дневного роста. Brent по состоянию на 16:42 мск. торговалась на отметке $73,42, с понижением на 0,14%. Ранее сегодня стало известно, что МЭА повысило прогноз спроса на нефть в 2025 году.нефть в четверг торгуется с минимальными изменениями, находясь под небольшим давлением после 3-дневного роста. Brent по состоянию на 16:42 мск. торговалась на отметке $73,42, с понижением на 0,14%. Ранее сегодня стало известно, что МЭА повысило прогноз спроса на нефть в 2025 году.","12.12.2024, 16:51",https://ru.investing.com/news/commodities-news/article-2599157
Нефть подскочила на новостях о перебоях в добыче,"© Reuters.
Investing.com — Нефть замедлила бычий ход после самого масштабного внутридневного прироста более чем за пять недель на фоне отступления доллара, пишет Bloomberg.Bloomberg. 
Черное золото также получило поддержку на фоне сообщений норвежской компании Equinor о сокращении добычи на крупнейшем в Западной Европе месторождении Johan Sverdrup из-за отключения электроэнергии. По словам представителя Equinor, ведутся работы по возобновлению добычи, но когда именно она возобновится, пока неясно.Equinor , ведутся работы по возобновлению добычи, но когда именно она возобновится, пока неясно. 
Кроме того, крупнейшее нефтяное месторождение Казахстана — Тенгиз, эксплуатируемое американской компанией Chevron, снизило добычу нефти на 28%—30% из-за ремонтных работ, что способствует дальнейшему сокращению глобальных поставок. Предполагается, что ремонт будет завершен к субботе, сообщило министерство энергетики страны.Chevron , снизило добычу нефти на 28%—30% из-за ремонтных работ, что способствует дальнейшему сокращению глобальных поставок. Предполагается, что ремонт будет завершен к субботе, сообщило министерство энергетики страны. 
Brent расположилась над уровнем $73 за баррель после роста на 3,2% в понедельник, а WTI поднялась выше $69. Оба контракта подрастали в пределах 0,2% по состоянию на 08:26 мск.Brent расположилась над уровнем $73 за баррель после роста на 3,2% в понедельник, а WTI поднялась выше $69. Оба контракта подрастали в пределах 0,2% по состоянию на 08:26 мск. 
Индекс доллара третий день несет потери, что играет на руку сырьевым товарам.Индекс доллара третий день несет потери, что играет на руку сырьевым товарам. 
Нефть по-прежнему в минусе с начала года, поскольку опасения по поводу китайского спроса и обильного мирового предложения довлеют над перспективами рынка.
Международное энергетическое агентство прогнозирует профицит более 1 миллиона баррелей в день в следующем году, поскольку спрос в Китае продолжает снижаться, и он может стать еще больше, если ОПЕК+ решит возобновить добычу.прогнозирует профицит более 1 миллиона баррелей в день в следующем году, поскольку спрос в Китае продолжает снижаться, и он может стать еще больше, если ОПЕК+ решит возобновить добычу. 
«Мы сохраняем медвежью позицию по нефти в средне- и долгосрочной перспективе», — сказал Чжоу Ми, аналитик из Chaos Research Institute в Шанхае. «Планируемое ОПЕК+ увеличение добычи и пик спроса в Китае повышают вероятность глобального перенасыщения», — добавил он.
«Мы сохраняем медвежью позицию по нефти в средне- и долгосрочной перспективе», — сказал Чжоу Ми, аналитик из Chaos Research Institute в Шанхае. «Планируемое ОПЕК+ увеличение добычи и пик спроса в Китае повышают вероятность глобального перенасыщения», — добавил он.
Тем временем на Ближнем Востоке Ливан и военизированная группировка «Хезболла» согласились на предложение США о прекращении огня с Израилем, согласно сообщению Reuters в понедельник, которое ссылается на высокопоставленного ливанского чиновника. Официальный представитель США предупредил, что переговоры продолжаются.","19.11.2024, 08:43",https://ru.investing.com/news/commodities-news/article-2575337
Нефть дорожает на обострении геополитических рисков,"© Reuters.
Investing.com — Цены на нефть выросли в понедельник после того, как в выходные обострилась обстановка на геополитическом фронте, пишет Reuters.Reuters. 
При этом опасения по поводу спроса на топливо в Китае, втором по величине потребителе в мире, и прогнозы по поводу избытка нефти в мире сдерживают бычий импульс.
Фьючерсы на Brent подорожали на 0,34%, до $71,28 за баррель к 10:35 мск., а контракты на WTI торговались на на уровне $67,11 за баррель, поднявшись на 0,31%.Brent подорожали на 0,34%, до $71,28 за баррель к 10:35 мск., а контракты на WTI торговались на на уровне $67,11 за баррель, поднявшись на 0,31%. 
Администрация президента Джо Байдена разрешила Украине использовать оружие американского производства для нанесения ударов вглубь территории России, заявили в воскресенье два американских чиновника и источник, знакомый с этим решением, что стало значительным поворотом в политике Вашингтона в конфликте между Украиной и Россией.
Это решение может привести к возвращению геополитической премии за риск на рынке нефти, поскольку это эскалация напряженности, сказал аналитик IG markets Тони Сикамор.
В России по меньшей мере три нефтеперерабатывающих завода были вынуждены остановить переработку или сократить объемы производства из-за больших убытков на фоне ограничений на экспорт, роста цен на нефть и высокой стоимости заимствований, по данным пяти источников в отрасли.остановить переработку или сократить объемы производства из-за больших убытков на фоне ограничений на экспорт, роста цен на нефть и высокой стоимости заимствований, по данным пяти источников в отрасли. 
На прошлой неделе Brent и WTI упали более чем на 3% на слабых данных из Китая и после того, как Международное энергетическое агентство предсказало, что в 2025 году мировое предложение нефти превысит спрос более чем на 1 млн баррелей в день, даже при условии сохранения сокращений добычи ОПЕК+.Brent и WTI упали более чем на 3% на слабых данных из Китая и после того, как Международное энергетическое агентство предсказало, что в 2025 году мировое предложение нефти превысит спрос более чем на 1 млн баррелей в день, даже при условии сохранения сокращений добычи ОПЕК+. 
Пропускная способность нефтеперерабатывающих заводов Китая в октябре упала на 4,6% по сравнению с прошлым годом, а рост производства на заводах страны замедлился в прошлом месяце, показали данные в пятницу.
Инвесторы также обеспокоены темпами и масштабами снижения процентных ставок Федеральной резервной системой США, что создает неопределенность на мировых финансовых рынках.
В США количество действующих нефтяных буровых установок на прошлой неделе сократилось на одну до 478, что является самым низким показателем с недели, завершившейся 19 июля, свидетельствуют данные Baker Hughes.","18.11.2024, 10:41",https://ru.investing.com/news/commodities-news/article-2574049
