Title,Text,Time,Url
Несколько банков КНР перестали принимать платежи из РФ: новости к утру 21 марта,"© Reuters.
Investing.com — Около десятка китайских банков перестали принимать платежи в юанях из России, а стоимость золота обновила исторический рекорд после заседания ФРС США — эти и другие важные новости к утру четверга, 21 марта, в нашем ежедневном обзоре.
Сразу несколько китайских банков перестали принимать платежи в юанях из России и начали возвращать такие трансакции клиентам. Об этом сообщил «Известиям» генеральный директор АО «Первая Группа» Алексей Порошин и подтвердил коммерческий директор компании «Импая Рус» Алексей Разумовский. Другие собеседники газеты рассказали, что банки Китая непубличным порядком оповестили клиентов из России о своем отказе от приема платежей в юанях, но у российских предпринимателей есть альтернативные способы для расчетов.«Известиям» генеральный директор АО «Первая Группа» Алексей Порошин и подтвердил коммерческий директор компании «Импая Рус» Алексей Разумовский. Другие собеседники газеты рассказали, что банки Китая непубличным порядком оповестили клиентов из России о своем отказе от приема платежей в юанях, но у российских предпринимателей есть альтернативные способы для расчетов. 
В моменте цена апрельского фьючерса на золото на бирже Comex (подразделение Нью-Йоркской товарной биржи) составила $2206,7 за тройскую унцию. Она выросла на 2,12% и обновила исторический рекорд. Прошлый рекорд биржевая стоимость золота побила 6 марта. Тогда цена апрельского фьючерса на Comex впервые превысила $2153 за тройскую унцию.золото на бирже Comex (подразделение Нью-Йоркской товарной биржи) составила $2206,7 за тройскую унцию. Она выросла на 2,12% и обновила исторический рекорд. Прошлый рекорд биржевая стоимость золота побила 6 марта. Тогда цена апрельского фьючерса на Comex впервые превысила $2153 за тройскую унцию. 
Совет директоров «Интер РАО» рекомендовал выплатить дивиденды за 2023 год в размере 32 копеек на акцию, следует из сообщения компании. Окончательное решение будет принято на годовом собрании акционеров «Интер РАО», которое состоится 22 мая.«Интер РАО» рекомендовал выплатить дивиденды за 2023 год в размере 32 копеек на акцию, следует из компании. Окончательное решение будет принято на годовом собрании акционеров «Интер РАО», которое состоится 22 мая. 
Минюст США планирует подать иск к американской корпорации Apple за нарушение антимонопольного законодательства, пишет Bloomberg. По данным агентства, иск может быть подан 21 марта. Ведомство обвиняет компанию в блокировании доступа к аппаратным программным функциям iPhone.Apple за нарушение антимонопольного законодательства, Bloomberg. По данным агентства, иск может быть подан 21 марта. Ведомство обвиняет компанию в блокировании доступа к аппаратным программным функциям iPhone. 
Reliance Industries, крупнейший оператор нефтепереработки в Индии, отказалась от поставок нефти из России танкерами «Совкомфлота» после того, как против него ввели санкции США, сообщает Reuters со ссылкой на источники в нефтяной отрасли и правительстве страны. Агентство направило запросы «Совкомфлоту» и Reliance, а также в министерства нефти и судоходства Индии.Reliance Industries , крупнейший оператор нефтепереработки в Индии, отказалась от поставок нефти из России танкерами «Совкомфлота» после того, как против него ввели санкции США, Reuters со ссылкой на источники в нефтяной отрасли и правительстве страны. Агентство направило запросы «Совкомфлоту» и Reliance, а также в министерства нефти и судоходства Индии. 
От редакции
Если вы ищете платформу, которая позволит вам с легкостью анализировать рыночные инструменты и отбирать именно те, которые подходят для вашего портфеля и вашего стиля инвестирования, как это делают наши авторы, предлагаем вам воспользоваться InvestingPro.. 
А мы дарим вам купон на дополнительную скидку 10% на двухгодовую подписку: RUTRADERS4EVER.
Не забудьте ввести купон в специальное поле при оформлении и оплате подписки!! 
Читайте нас в Telegram и «ВКонтакте».и","21.03.2024, 09:57",https://ru.investing.com/news/economy/article-2388602
Bloomberg сообщил о планах Силуанова и Набиуллиной после выборов,"Investing.com — После выборов президента, которые состоятся в России на этой неделе с 15 по 17 марта, источники Bloomberg ожидают начало перестановок в правительстве впервые с 2020 года. По данным агентства, они не затронут финансовые власти.начало перестановок в правительстве впервые с 2020 года. По данным агентства, они не затронут финансовые власти. 
Bloomberg уточняет, что министр финансов Антон Силуанов останется на своем посту, как и глава ЦБ Эльвира Набиуллина, чью отставку источники называют маловероятной.
Среди лиц, кто может уйти с поста — 72-летний министр энергетики Николай Шульгинов. Одним из тех, кто может его заменить, является Борис Ковальчук, который, как ожидается, покинет должность президента холдинга «Интер РАО (MCX:IRAO)» на этой неделе, сообщили источники.IRAO )» на этой неделе, сообщили источники. 
Ковальчук может возглавить «Газпром (MCX:GAZP)», «Роснефть (MCX:ROSN)», стать вице-премьером по ТЭКу вместо Александра Новака или губернатором Санкт-Петербурга, сообщал недавно «Коммерсантъ» также со ссылкой на источники.GAZP )», «Роснефть (MCX: ROSN )», стать вице-премьером по ТЭКу вместо Александра Новака или губернатором Санкт-Петербурга, недавно «Коммерсантъ» также со ссылкой на источники. 
От редакции
Если вы ищете платформу, которая позволит вам с легкостью анализировать рыночные инструменты и отбирать именно те, которые подходят для вашего портфеля и вашего стиля инвестирования, как это делают наши авторы, предлагаем вам воспользоваться InvestingPro.. 
А мы дарим вам купон на дополнительную скидку 10% на двухгодовую подписку: RUTRADERS4EVER.
Не забудьте ввести купон в специальное поле при оформлении и оплате подписки!! 
Читайте нас в Telegram и «ВКонтакте».и","12.03.2024, 18:34",https://ru.investing.com/news/economy/article-2384315
Котировки Росбанка выросли на одобрении выкупа акций у Societe Generale,"© Reuters.
Investing.com — Акции АКБ Росбанка подорожали на 14,19%, до 107,8 руб. за бумагу, в начале торгов Московской биржи. Накануне президент Владимир Путин разрешил Росбанку выкупить акции французской финансовой группы Societe Generale (EPA:SOGN) в ВТБ (MCX:VTBR), «Россетях», «РусГидро (MCX:HYDR)», «Интер РАО (MCX:IRAO)», «Газпроме (MCX:GAZP)», «Сургутнефтегазе (MCX:SNGS)», АЛРОСА (MCX:ALRS) и других компаниях.Росбанка подорожали на 14,19%, до 107,8 руб. за бумагу, в начале торгов Московской биржи. Накануне президент Владимир Путин разрешил Росбанку выкупить акции французской финансовой группы Societe Generale Societe Generale (EPA: SOGN ) в ВТБ (MCX: VTBR ), «Россетях», «РусГидро (MCX: HYDR )», «Интер РАО (MCX: IRAO )», «Газпроме (MCX: GAZP )», «Сургутнефтегазе (MCX: SNGS )», АЛРОСА (MCX: ALRS ) и других компаниях. 
Речь идет о покупке миноритарных пакетов акций 24 публичных компаний. Каждый по отдельности пакет небольшой — например, 0,01% ВТБ и 0,04% «Газпрома». Решение было принято в соответствии с указом Путина от 5 августа 2022 года, который ограничивает продажу российских активов иностранцам из недружественных государств, пишет РБК.РБК. 
По текущей рыночной цене российские бумаги, принадлежащие Societe Generale, оцениваются в 7,3 млрд руб. Информации о цене сделки нет, но можно предположить, что выкуп у иностранных держателей должен происходить с дисконтом как минимум в 50%, рассказали в «БКС Мир инвестиций». По оценкам экспертов, выгода Росбанка от покупки бумаг может быть более 3,65 млрд руб. Это 2,5% от текущей рыночной капитализации банка.
От редакции
Если вы ищете платформу, которая позволит вам с легкостью анализировать рыночные инструменты и отбирать именно те, которые подходят для вашего портфеля и вашего стиля инвестирования, как это делают наши авторы, предлагаем вам воспользоваться InvestingPro.. 
А мы дарим вам купон на дополнительную скидку 37% на двухгодовую подписку: RUTRADERS4EVER.
Не забудьте ввести купон в специальное поле при оформлении и оплате подписки!! 
Читайте нас в Telegram и «ВКонтакте».и","25.12.2023, 11:19",https://ru.investing.com/news/stock-market-news/article-2341595
Индекс Мосбиржи резко упал в конце недели,"© Reuters.
Investing.com — Индекс Мосбиржи во второй половине дня в пятницу резко упал. В 15:25 МСК он снизился до 3073,69 пункта, хотя ранее в течение дня поднимался до отметки 3194,83 пункта. Это самое резкое падение индекса за час с 18 октября 2022 года, пишет Forbes.Мосбиржи во второй половине дня в пятницу резко упал. В 15:25 МСК он снизился до 3073,69 пункта, хотя ранее в течение дня поднимался до отметки 3194,83 пункта. Это самое резкое падение индекса за час с 18 октября 2022 года, Forbes. 
Индекс РТС также упал — с 1058,48 пункта на торгах днем до 1017,71.РТС также упал — с 1058,48 пункта на торгах днем до 1017,71. 
Сильнее всего на торгах в пятницу снижались акции АФК «Система» (-6,1%), «Интер РАО» (-5,7%), «Русгидро (MCX:HYDR)» (-4,9%), TCS Group (MCX:TCSGDR) (-4,3%), «Яндекса (MCX:YNDX)» (-4%), «Алросы (MCX:ALRS)» (-3,8%), ММК (MCX:MAGN) (-3,7%), «Сургутнефтегаза (MCX:SNGS)» (-3,2%), «Магнита (MCX:MGNT)» (-3,1%) и «Северстали (MCX:CHMF)» (-3%). Доллар рос до 95,09 рубля (+0,1 рубля), превысив отметку 95 рублей впервые с марта 2022 года.HYDR )» (-4,9%), TCS Group (MCX: TCSGDR ) (-4,3%), «Яндекса (MCX: YNDX )» (-4%), «Алросы (MCX: ALRS )» (-3,8%), ММК (MCX: MAGN ) (-3,7%), «Сургутнефтегаза (MCX: SNGS )» (-3,2%), «Магнита (MCX: MGNT )» (-3,1%) и «Северстали (MCX: CHMF )» (-3%). Доллар рос до 95,09 рубля (+0,1 рубля), превысив отметку 95 рублей впервые с марта 2022 года. 
Фондовые индексы упали в отсутствие значимых новостей. Падение может быть связано с тем, что инвесторы «решили не переносить открытые позиции через выходные и активно фиксируют накопленную прибыль», отмечает Telegram-канал «Мои инвестиции».
Позже оба индекса отыграли часть падения, на 15:50 индекс Мосбиржи поднялся до 3141 пункта, индекс РТС — до 1040 пунктов.
Читайте нас в Telegram и «ВКонтакте».и 
Текст подготовил Тимур Алиев","04.08.2023, 17:06",https://ru.investing.com/news/stock-market-news/article-2281752
Euroclear возобновил расчеты по бумагам ряда компаний РФ,"© Reuters
Investing.com — Международный депозитарий Euroclear возобновил расчеты по локальным акциям ряда не попавших под санкции российских компаний, а также по евробондам и расширил список торгуемых ОФЗ, пишет РБК.РБК. 
В перечень входят такие эмитенты, как Газпром, «Газпром нефть», ЛУКОЙЛ, «Норникель», «Мечел», Московская Биржа, «Интер РАО», «Магнит», «Аэрофлот», АФК «Система», «Сегежа», МТС, «М.Видео», «Детский мир», «Белуга» и многие другие ценные бумаги с идентификационным кодом RU ISIN. Речь идет о расчетах во внешнем периметре.Газпром , «Газпром нефть» , ЛУКОЙЛ , «Норникель» , «Мечел» , Московская Биржа , «Интер РАО» , «Магнит» , «Аэрофлот» , АФК «Система» , «Сегежа» , МТС , «М.Видео» , «Детский мир» , «Белуга» и многие другие ценные бумаги с идентификационным кодом RU ISIN. Речь идет о расчетах во внешнем периметре. 
Всего в письме депозитария Euroclear перечислены 137 российских локальных бумаг, которые стали доступны для расчетов в Euroclear Bank по состоянию на 26 июня 2023 года. Подлинность письма подтвердили два источника на финансовом рынке.
В сообщении европейского депозитария подчеркивается, что Euroclear возобновил свободные расчеты по тем российским бумагам, по которым не требуется сверка, связанная с законами о принудительном переводе, и активы которых не подлежат замораживанию в связи с международными санкциями.
Также Euroclear отмечает, что список ценных бумаг, по которым могут быть возобновлены расчеты, после проверок будет расширяться.
«Euroclear Bank продолжит оценивать и проверять список приостановленных ценных бумаг и может возобновить расчеты по дополнительным ценным бумагам, соответствующим стандартным операционным проверкам», — говорится в сообщении депозитария.
«Euroclear Bank продолжит оценивать и проверять список приостановленных ценных бумаг и может возобновить расчеты по дополнительным ценным бумагам, соответствующим стандартным операционным проверкам», — говорится в сообщении депозитария.
Читайте нас в Telegram и «ВКонтакте».и 
Текст подготовил Тимур Алиев","29.06.2023, 12:03",https://ru.investing.com/news/stock-market-news/article-2268728
