Title,Text,Time,Url
В Дагестане пресечена деятельность подпольной майнинговой фермы,"© Reuters. В Дагестане пресечена деятельность подпольной майнинговой фермы
В ходе проверки сотрудниками департамента обеспечения безопасности ПАО «Россети Северный Кавказ (MCX:MRKK)» по Республике Дагестан, отдела контроля и проверок потребителей электроэнергии филиала «Дагэнерго» и МВД, было выяснено, что ферма состояла из 408 устройств для майнинга криптовалют.MRKK )» по Республике Дагестан, отдела контроля и проверок потребителей электроэнергии филиала «Дагэнерго» и МВД, было выяснено, что ферма состояла из 408 устройств для майнинга криптовалют. 
Владелец фермы без разрешения осуществил подключение к сети. Объем похищенного энергоресурса составил свыше 27 кВт-ч, а ущерб от деятельности майнинговой фермы превысил 180 млн рублей. Материалы дела переданы в правоохранительные органы.
Ранее сотрудники правоохранительных органов и работники филиала «Дагэнерго» обнаружили в Сергокалинском районе республики Дагестан майнинговую ферму, спрятанную в подземном убежище.
Читайте оригинальную статью на сайте Bits.media","14.01.2025, 14:46",https://ru.investing.com/news/cryptocurrency-news/article-2621141
Дагестанские майнеры похитили электроэнергию на 158 млн рублей,"© Reuters. Дагестанские майнеры похитили электроэнергию на 158 млн рублей
В главном офисе сетевой компании заявили, что одна из самых крупных ферм была обнаружена в городе Каспийске.

«Мощность незаконной майнинг-фермы составляла около 1 МВт, что сравнимо с электроснабжением жилого комплекса на 300 квартир», — говорят энергетики.


«При этом в целом за 2022 год и первое полугодие 2023 года объем похищенной электроэнергии составил почти 34 млн кВт.ч».

Тем временем, в Иркутской области, которая считается столицей российского майнинга, нелегальные майнеры украли электроэнергии на 350 млн рублей. Теперь суд пытается взыскать с них деньги за ворованное электричество.
Читайте оригинальную статью на сайте Bits.media","25.08.2023, 18:28",https://ru.investing.com/news/cryptocurrency-news/article-2287071
"""Россети Северный Кавказ"" сократили чистый убыток по МСФО в 3-м квартале на 3,8%","""Россети Северный Кавказ"" сократили чистый убыток по МСФО в 3-м квартале на 3,8%

Выручка в 3-м квартале выросла на 5,6%, до 9,337 млрд рублей. Операционный убыток сократился на 23,4%, до 2,011 млрд рублей. Операционные расходы при этом выросли на 4,7% - до 10,851 млрд рублей.
Показатель EBITDA составил 1,677 млрд рублей (снижение на 24,1%).
В январе-сентябре этого года чистый убыток компании сократился на 3,3% относительно января-сентября прошлого года - до 8,837 млрд рублей. Выручка увеличилась на 15,1% - до 28,531 млрд рублей. Операционный убыток снизился на 23,8% - до 7,893 млрд рублей. Операционные расходы возросли на 20,5%, до 35,167 млрд рублей.
EBITDA уменьшилась на 25% - до 6,509 млрд рублей.
Как сообщалось, ПАО ""Россети (MCX:RSTI) Северный Кавказ"" в январе-сентябре 2022 года получило чистый убыток по РСБУ в размере 6 млрд 657,7 млн рублей, что на 31% меньше, чем за аналогичный период 2021 года. При этом выручка выросла на 17,6%, до 29,839 млрд рублей.RSTI ) Северный Кавказ"" в январе-сентябре 2022 года получило чистый убыток по РСБУ в размере 6 млрд 657,7 млн рублей, что на 31% меньше, чем за аналогичный период 2021 года. При этом выручка выросла на 17,6%, до 29,839 млрд рублей. 
ПАО ""Россети Северный Кавказ"" обеспечивает передачу электроэнергии по сетям напряжением от 0,4 кВ до 110 кВ, а также осуществляет технологическое присоединение потребителей к сетевой инфраструктуре на территории Северо-Кавказского федерального округа. ПАО ""Россети владеет 99,17% акций компании.","25.11.2022, 13:22",https://ru.investing.com/news/economy/article-2203529
"Квартальный чистый убыток ""Россети Северный Кавказ"" по МСФО вырос на 13,7%","Квартальный чистый убыток ""Россети Северный Кавказ"" по МСФО вырос на 13,7%

В первом полугодии этого года чистый убыток сократился на 3% относительно января-июня прошлого года - до 6,537 млрд рублей.
Выручка во II квартале выросла на 20,4%, до 8,649 млрд рублей. Убыток до налогообложения сократился в 1,4 раза до 2,913 млрд рублей. Операционная прибыль упала в 1,5 раза до 2,484 млрд рублей. Операционные расходы при этом выросли в 1,3 раза - до 10,569 млрд рублей, а финансовые расходы - на 13,7% и достигли 520 млн рублей. Показатель EBITDA составил 1,534 млрд рублей (снижение в 2 раза).
В январе-июне выручка ""Россети (MCX:RSTI) Северный Кавказ"" увеличилась в 1,2 раза - до 19,199 млрд рублей. Операционная прибыль снизилась в 1,3 раза - до 5,882 млрд рублей. Операционные расходы возросли в 1,3 раза, до 24,3 млрд рублей, финансовые - на 12,3%, до 993 млн рублей. EBITDA уменьшилась в 1,6 раза - до 4,318 млрд рублей.RSTI ) Северный Кавказ"" увеличилась в 1,2 раза - до 19,199 млрд рублей. Операционная прибыль снизилась в 1,3 раза - до 5,882 млрд рублей. Операционные расходы возросли в 1,3 раза, до 24,3 млрд рублей, финансовые - на 12,3%, до 993 млн рублей. EBITDA уменьшилась в 1,6 раза - до 4,318 млрд рублей. 
Активы компании с начала года выросли на 6,7% и достигли 18,963 млрд рублей.
Как сообщалось, ""Россети Северный Кавказ"" в январе-июне 2022 года получило чистый убыток по РСБУ в размере 4,52 млрд рублей, что на 34,9% меньше, чем в первом полугодии 2021 года. При этом выручка выросла на 22,4%, до 20,072 млрд рублей.
ПАО ""Россети Северный Кавказ"" обеспечивает передачу электроэнергии по сетям напряжением от 0,4 кВ до 110 кВ, а также осуществляет технологическое присоединение потребителей к сетевой инфраструктуре на территории Северо-Кавказского федерального округа. ПАО ""Россети"" владеет 99,17% акций компании.","26.08.2022, 16:50",https://ru.investing.com/news/economy/article-2178204
"Мишустин поручил выделить ""Россети Северный Кавказ"" 890,8 млн руб. на развитие сетевого комплекса Дагестана","Мишустин поручил выделить ""Россети Северный Кавказ"" 890,8 млн руб. на развитие сетевого комплекса Дагестана

""Планируется, что средства пойдут на возмещение затрат, связанных с восстановлением распределительных сетей в Дагестане и с приобретением спецтехники для ремонтных бригад"", - говорится в сообщении.
Согласно информации пресс-службы, текущее состояние электросетевого комплекса в Дагестане обусловлено недофинансированием, а также отсутствием возможности развития и выполнения текущих ремонтов на должном уровне. Основные причины - недостаточность тарифных источников, а также низкая платежная дисциплина. На протяжении многих лет платежи предприятий ЖКХ составляют в среднем 12%, населения - 80%.
ПАО ""Россети (MCX:RSTI) Северный Кавказ"" обеспечивает передачу электроэнергии по сетям напряжением от 0,4 кВ до 110 кВ, а также осуществляет технологическое присоединение потребителей к сетевой инфраструктуре на территории Северо-Кавказского федерального округа. ПАО ""Россети"" владеет 98,77% акций компании.RSTI ) Северный Кавказ"" обеспечивает передачу электроэнергии по сетям напряжением от 0,4 кВ до 110 кВ, а также осуществляет технологическое присоединение потребителей к сетевой инфраструктуре на территории Северо-Кавказского федерального округа. ПАО ""Россети"" владеет 98,77% акций компании. 
23 декабря президент РФ Владимир Путин в ходе пресс-конференции пообещал ""разобраться"" с проблемой энергоснабжения в Дагестане. 24 декабря в ПАО ""Россести"" сообщили ""Интерфаксу"", что компания планирует вложить в модернизацию сетевого комплекса Дагестана почти 7,7 млрд руб. в 2022-2023 гг.","26.12.2021, 15:37",https://ru.investing.com/news/economy/article-2124719
"""Россети"" не исключают снижения финпоказателей по МСФО в 2021 году","© Reuters. ""Россети"" не исключают снижения финпоказателей по МСФО в 2021 году

""Мы предполагаем, что влияние этих (внешних и внутренних) факторов может стать причиной значительного снижения финансового результата группы компаний ""Россети"" по МСФО за 2021 год, с учетом проведения теста на обесценение стоимости активов в рамках стандартов международной отчетности"", - отметили в компании.
В компании напомнили, что на отчетности самого ПАО ""Россети"" сказываются финрезультаты подконтрольных структур. По итогам января-сентября этого года большинство из них показали ""хорошую динамику"" финпоказателей. ""Однако в отсутствии теста на обесценение основных средств и капитальных вложений, который в этом году в отличии от 2020 года еще не проводился, прогнозы по положительным итогам годам строить пока рано"", - отмечают в компании.
Так, внутри группы на общую отчетность негативно влияет подконтрольная компания ""Россети Северный Кавказ (MCX:MRKK)"", что в группе связывают с ""хроническим недофинансированием модернизации сетей, высоким уровнем потерь и низкой платежной дисциплиной"".MRKK )"", что в группе связывают с ""хроническим недофинансированием модернизации сетей, высоким уровнем потерь и низкой платежной дисциплиной"". 
В качестве первого внешнего негативного фактора ""Россети"" выделяют значительный рост ставки ЦБ в этом году, который влияет на стоимость заимствований группы. Также ""Россети"" беспокоит повышение стоимости металлов - ""более 40% в текущем году, который увеличил стоимость всей номенклатуры металлоемких конструкций и оборудования, используемых при строительстве энергообъектов в том числе проводов, опор и пр."", и ограничение роста тарифа на передачу ""существенно ниже инфляции"" (предусмотрено макропрогнозом).
Кроме того, на результатах группы может сказаться и рост стоимости скорректированной инвестпрограммы дочерней ""ФСК ЕЭС (MCX:FEES)"" по итогам этого года. Здесь, в частности, речь идет ""об объемах реализации мероприятий внешнего электроснабжения БАМа-2 и Транссиба"".FEES )"" по итогам этого года. Здесь, в частности, речь идет ""об объемах реализации мероприятий внешнего электроснабжения БАМа-2 и Транссиба"". 
Как сообщалось, по итогам 2020 года чистая прибыль ПАО ""Россети"" по МСФО составила 61,12 млрд руб., что на 41,9% меньше показателя 2019 года, EBITDA при этом сократилась на 10,9%, до 288,46 млрд руб.
За январь-сентябрь этого года ""Россети"" увеличили EBITDA с 228,3 млрд до 263,24 млрд руб., чистую прибыль - с 77,87 до 104,8 млрд руб.
ПАО ""Россети"" - крупнейшая электросетевая компания России, объединяющая в своей структуре магистральный электросетевой комплекс, межрегиональные и региональные распределительные электросетевые компании.","01.12.2021, 15:31",https://ru.investing.com/news/stock-market-news/article-2114849
