Title,Text,Time,Url
Сбер запустил цифровые финансовые активы на дизельное топливо и бензин,"Сбер запустил цифровые финансовые активы на дизельное топливо и бензин
Happycoin.club - Сбер представил в России цифровые финансовые активы (ЦФА) на бензин и дизельное топливо на собственной платформе «Цифровые активы». Эти продукты будут доступны исключительно квалифицированным инвесторам.
Как указали представители Сбера (MCX:SBER), цифровые финансовые активы на бензин и дизельное топливо индексные. Их котировки определяются с учётом торгов на Санкт-Петербургской международной товарно-сырьевой бирже (СПбМТСБ).SBER ), цифровые финансовые активы на бензин и дизельное топливо индексные. Их котировки определяются с учётом торгов на Санкт-Петербургской международной товарно-сырьевой бирже (СПбМТСБ). 
Стоимость одного цифрового финансового актива привязана к стоимости 1/10 тонны топлива, что позволило снизить порог входа для инвесторов, указано в пресс-релизе Сбера.
В банке отметили, что каждый из квалифицированных инвесторов имеет право досрочно выйти из цифровых финансовых активов вне зависимости от ликвидности на торгах.
Отметим, что согласно оценкам агентства «Эксперт РА», рост рынка цифровых финансовых активов в этом году в разы превысил ожидания участников рынка.
В частности, объём выпущенных за первые девять месяцев 2024 года ЦФА составил около 316 млрд руб. (470 выпусков) при прогнозируемых 125 млрд руб. (300 выпусков). Аналитики ожидают, что в следующем году рынок покажет ещё больший рост.
Сейчас законодатели готовят комплекс предложений, направленных на то, чтобы вместо использования банковских кредитов бизнес привлекал средства за счёт инвестиционных инструментов, включая цифровые финансовые активы.
Читайте оригинальную статью на сайте Happycoin.club","26.12.2024, 16:17",https://ru.investing.com/news/cryptocurrency-news/article-2609389
Брокер Сбербанка дал доступ физлицам к первичным аукционам ОФЗ,"© Reuters Брокер Сбербанка дал доступ физлицам к первичным аукционам ОФЗ
Frankmedia - В брокерском приложении «СберИнвестиции» появилась возможность участия физическим лицам в аукционах Минфина по размещению облигаций федерального займа (ОФЗ), удостоверились корреспонденты Frank Media.
В частности, брокер давал возможность инвесторам принять участие в проходящих в среду, 25 декабря, аукционах ОФЗ с постоянным купонным доходом (ОФЗ-ПД) выпусков 26247 и 26242.
В конце ноября «РБК Инвестиции» со ссылкой на пресс-службу Сбербанка (MCX:SBER) писали, что в приложении «Сбербанк Онлайн» (СБОЛ) стала доступна опция заключения сделок с облигациями в выходные дни и праздники. В список доступных для сделок в нерабочие дни вошли наиболее ликвидные бонды.SBER ) писали, что в приложении «Сбербанк Онлайн» (СБОЛ) стала доступна опция заключения сделок с облигациями в выходные дни и праздники. В список доступных для сделок в нерабочие дни вошли наиболее ликвидные бонды. 
Согласно расчетам Frank Media на основе данных министерства финансов и ЦБ, на аукционах по размещению ОФЗ в ноябре розничные инвесторы приобрели госбумаг на 2,6 млрд рублей, в октябре – на 1,4 млрд рублей, а в сентябре – на 0,9 млрд рублей.
В ноябре на вторичном рынке нетто-покупки ОФЗ физическими лицами составили 4,1 млрд рублей, в октябре розничные инвесторы приобрели гособлигаций на 17,1 млрд рублей, в сентябре – на 10 млрд рублей.
Читайте оригинальную статью на сайте Frankmedia","25.12.2024, 14:58",https://ru.investing.com/news/general/article-2609026
Инвестхолдинг SFI полностью погасил свой долг  ,"© Reuters. Инвестхолдинг SFI полностью погасил свой долг  
Frankmedia - Инвестиционный холдинг SFI («ЭсЭфАй») полностью погасил остаток задолженности в размере 9,7 млрд рублей по кредитному договору, сократив тем самым до нуля объем своих текущих кредитных обязательств, следует из сообщения компании.
Холдинг еще в декабре 2019 года открыл у банка ВТБ (MCX:VTBR) кредитную линию на 21 млрд рублей для финансирования обратного выкупа акций с биржи. На конец 2020 года долг перед ВТБ достиг почти 18 млрд рублей, однако затем постепенно снижался, в том числе за счет продажи холдингом активов, крупнейшим из которых был НПФ «Сафмар».VTBR ) кредитную линию на 21 млрд рублей для финансирования обратного выкупа акций с биржи. На конец 2020 года долг перед ВТБ достиг почти 18 млрд рублей, однако затем постепенно снижался, в том числе за счет продажи холдингом активов, крупнейшим из которых был НПФ «Сафмар». 
На конец третьего квартала 2021 года долг перед ВТБ составлял 13,7 млрд рублей. В ноябре 2021 холдинг реструктуризировал свой кредит в Совкомбанке, в котором SFI привлек средства до конца ноября 2024 года объемом 13,7 млрд рублей. В Совкомбанке была открыта не кредитная линия, а непосредственно кредит.
Заместитель генерального директора SFI Олег Андриянкин отметил, что «отсутствие кредитных обязательств на корпоративном центре должно позитивно сказаться на оценке холдинга рынком – инвесторами, аналитиками и рейтинговыми агентствами».
«ЭсЭфАй» был создан семьей российского бизнесмена Михаила Гуцериева в конце 2016 года. Сначала он объединял небанковские финансовые активы, но затем превратился в универсальный холдинг. На данный момент в него входит 87,5% акций лизинговой компании «Европлан», 49% страховой компании ВСК, а также 10,4% ритейлера «М.Видео (MCX:MVID)».MVID )». 
Читайте оригинальную статью на сайте Frankmedia","23.12.2024, 11:22",https://ru.investing.com/news/general/article-2607734
Госбанки снова повысили ставки по депозитам накануне решения ЦБ,"© Пресс-служба банка ВТБ Госбанки снова повысили ставки по депозитам накануне решения ЦБ
Frankmedia - ВТБ (MCX:VTBR) и Сбербанк повысили ставки по депозитам перед решением ЦБ о ставке 20 декабря (текущая 21%). Таким образом, ВТБ с 17 декабря повысил ставки по вкладам на 3 месяца до 23,7% годовых, на 6 месяцев – до 24% годовых при выплате процентов в конце срока для всех сегментов, сообщил банк. Максимальная ставка доступна действующим клиентам, получающим зарплату или пенсию на карту банка, а также состоятельным клиентам.VTBR ) и Сбербанк повысили ставки по депозитам перед решением ЦБ о ставке 20 декабря (текущая 21%). Таким образом, ВТБ с 17 декабря повысил ставки по вкладам на 3 месяца до 23,7% годовых, на 6 месяцев – до 24% годовых при выплате процентов в конце срока для всех сегментов, сообщил банк. Максимальная ставка доступна действующим клиентам, получающим зарплату или пенсию на карту банка, а также состоятельным клиентам. 
«Мы ожидаем роста ключевой ставки на ближайшем заседании ЦБ, поэтому заблаговременно повышаем ставки по вкладам», – уточнил зампред правления ВТБ Георгий Горшков.
В Сбербанке (MCX:SBER) с 16 декабря приветственная ставка по накопительному счету составляет 18% годовых (было 16% годовых) в первые три месяца, свидетельствуют тарифы банка. С четвертого месяца ставка составит 10% годовых, но ее можно увеличить до 18% годовых если подключить платные подписки «СберПрайм/ СберПрайм+», за покупки от ₽5 тысяч в магазинах — партнерах банка, за траты по картам «Сбера» от 30 тысяч в месяц.SBER ) с 16 декабря приветственная ставка по накопительному счету составляет 18% годовых (было 16% годовых) в первые три месяца, свидетельствуют тарифы банка. С четвертого месяца ставка составит 10% годовых, но ее можно увеличить до 18% годовых если подключить платные подписки «СберПрайм/ СберПрайм+», за покупки от ₽5 тысяч в магазинах — партнерах банка, за траты по картам «Сбера» от 30 тысяч в месяц. 
По вкладу «СберВклад» максимальная процентная ставка достигает 22,5% годовых при открытии депозита на полгода и вложении от 1 млн с учетом всех надбавок. Для вкладов, сумма которых составляет до 1 млн рублей, максимальная доходность с учетом надбавок составит 22% годовых. Если подключить пакет «СберПремьер», ставка по вкладу «СберВклад» на полгода повысится до 23% годовых.
Индекс ставок по годовым вкладам и депозитам банков на сумму 100 тысяч рублей на 17 декабря составляет 17,74%, свидетельствуют данные индекса ставок FRG100.
Читайте оригинальную статью на сайте Frankmedia","17.12.2024, 09:14",https://ru.investing.com/news/general/article-2602510
