Title,Text,Time,Url
Индекс Мосбиржи на максимуме с февраля 2022 года: новости к утру 10 июля,"© Reuters.
Investing.com — Индекс Мосбиржи достиг максимума с февраля 2022 года, а аналог Twitter (NYSE:TWTR) от Цукерберга набрал 70 млн пользователей за два дня — эти и другие важные новости к утру понедельника, 10 июля, в нашем ежедневном обзоре.TWTR ) от Цукерберга набрал 70 млн пользователей за два дня — эти и другие важные новости к утру понедельника, 10 июля, в нашем ежедневном обзоре. 
Индекс Мосбиржи достиг максимума с 22 февраля 2022 года. По состоянию на 10:12 МСК индекс вырос на 0,59%, до 2849,45 пункта. Одновременно с этим индекс РТС прибавил 0,27%, до 978,8 пункта. По состоянию на 10:13 МСК лидерами роста в составе индекса Мосбиржи стали бумаги «Полиметалла» (+2,87%), «Сегежи» (+2,14%), ВТБ (+1,65%), ОАО АК АЛРОСА (+1,34%), En+ Group (+1,24%).Индекс Мосбиржи достиг максимума с 22 февраля 2022 года. По состоянию на 10:12 МСК индекс вырос на 0,59%, до 2849,45 пункта. Одновременно с этим индекс РТС прибавил 0,27%, до 978,8 пункта. По состоянию на 10:13 МСК лидерами роста в составе индекса Мосбиржи стали бумаги «Полиметалла» (+2,87%), «Сегежи» (+2,14%), ВТБ (+1,65%), ОАО АК АЛРОСА (+1,34%), En+ Group (+1,24%). 
Приложение Threads от Meta* за два дня с момента запуска набрало 70 млн пользователей. Об этом на своей странице в Threads заявил основатель и глава Meta Марк Цукерберг. «70 миллионов пользователей на Threads на сегодняшнее утро. Это намного больше, чем мы ожидали», — написал Цукерберг.Meta* за два дня с момента запуска набрало 70 млн пользователей. Об этом на своей странице в Threads заявил основатель и глава Meta Марк Цукерберг. «70 миллионов пользователей на Threads на сегодняшнее утро. Это намного больше, чем мы ожидали», — Цукерберг. 
Скидки на российскую нефть для индийских НПЗ сократились до $4 за баррель после пиковых значений в $25–30, а продавцы отказываются от тарифов на отгрузку, чтобы покрыть разрыв с эталонной нефтью марки Brent и обойти западный потолок цен, пишет The Times of India со ссылкой на источники, знакомые с ситуацией.Brent и обойти западный потолок цен, The Times of India со ссылкой на источники, знакомые с ситуацией. 
Компании Джека Ма потеряли больше $850 млрд стоимости из-за конфликта бизнесмена с Пекином. Об этом пишет Bloomberg, подводя итоги развернутой в отношении миллиардера кампании китайских властей, которая длилась почти три года.Bloomberg, подводя итоги развернутой в отношении миллиардера кампании китайских властей, которая длилась почти три года. 
Все больше стран репатриируют свои золотые резервы, опасаясь санкций, которые страны Запада ввели против России. Об этом пишет Reuters со ссылкой на опрос центробанков и суверенных фондов, проведенный американской инвестиционной компанией Invesco.Reuters со ссылкой на опрос центробанков и суверенных фондов, проведенный американской инвестиционной компанией Invesco. 
*Компания Meta признана в России террористической организацией и запрещена
Читайте нас в Telegram и «ВКонтакте».и 
Текст подготовил Тимур Алиев","10.07.2023, 10:57",https://ru.investing.com/news/economy/article-2271406
Euroclear возобновил расчеты по бумагам ряда компаний РФ,"© Reuters
Investing.com — Международный депозитарий Euroclear возобновил расчеты по локальным акциям ряда не попавших под санкции российских компаний, а также по евробондам и расширил список торгуемых ОФЗ, пишет РБК.РБК. 
В перечень входят такие эмитенты, как Газпром, «Газпром нефть», ЛУКОЙЛ, «Норникель», «Мечел», Московская Биржа, «Интер РАО», «Магнит», «Аэрофлот», АФК «Система», «Сегежа», МТС, «М.Видео», «Детский мир», «Белуга» и многие другие ценные бумаги с идентификационным кодом RU ISIN. Речь идет о расчетах во внешнем периметре.Газпром , «Газпром нефть» , ЛУКОЙЛ , «Норникель» , «Мечел» , Московская Биржа , «Интер РАО» , «Магнит» , «Аэрофлот» , АФК «Система» , «Сегежа» , МТС , «М.Видео» , «Детский мир» , «Белуга» и многие другие ценные бумаги с идентификационным кодом RU ISIN. Речь идет о расчетах во внешнем периметре. 
Всего в письме депозитария Euroclear перечислены 137 российских локальных бумаг, которые стали доступны для расчетов в Euroclear Bank по состоянию на 26 июня 2023 года. Подлинность письма подтвердили два источника на финансовом рынке.
В сообщении европейского депозитария подчеркивается, что Euroclear возобновил свободные расчеты по тем российским бумагам, по которым не требуется сверка, связанная с законами о принудительном переводе, и активы которых не подлежат замораживанию в связи с международными санкциями.
Также Euroclear отмечает, что список ценных бумаг, по которым могут быть возобновлены расчеты, после проверок будет расширяться.
«Euroclear Bank продолжит оценивать и проверять список приостановленных ценных бумаг и может возобновить расчеты по дополнительным ценным бумагам, соответствующим стандартным операционным проверкам», — говорится в сообщении депозитария.
«Euroclear Bank продолжит оценивать и проверять список приостановленных ценных бумаг и может возобновить расчеты по дополнительным ценным бумагам, соответствующим стандартным операционным проверкам», — говорится в сообщении депозитария.
Читайте нас в Telegram и «ВКонтакте».и 
Текст подготовил Тимур Алиев","29.06.2023, 12:03",https://ru.investing.com/news/stock-market-news/article-2268728
На Мосбирже с 29 июня появятся 4 новые российские акции,"© Reuters.
Investing.com — Московская биржа с 29 июня запустит торги поставочными фьючерсами на акции еще четырех российских компаний, сообщается на сайте площадки. В их число вошли:на сайте площадки. В их число вошли: 
Минимальный шаг цены для всех фьючерсов составляет 1 руб. К торгам будут допущены контракты с исполнением в сентябре и декабре 2023 года, а также в марте и июне 2024 года. Поставка по контрактам производится автоматически: на торгах Московской биржи заключаются сделки с расчетами на второй день.
«Новые контракты на ценные бумаги, обращающиеся на рынке акций Московской биржи, предоставят дополнительные возможности для реализации различных торговых стратегий и хеджирования портфелей ценных бумаг широкому кругу частных и институциональных инвесторов», — сказано в пресс-релизе.
«Новые контракты на ценные бумаги, обращающиеся на рынке акций Московской биржи, предоставят дополнительные возможности для реализации различных торговых стратегий и хеджирования портфелей ценных бумаг широкому кругу частных и институциональных инвесторов», — сказано в пресс-релизе.
После запуска новых инструментов инвесторам будет доступно 44 контракта на акции российских компаний.
Читайте нас в Telegram и «ВКонтакте».и 
Текст подготовил Тимур Алиев","23.06.2023, 13:16",https://ru.investing.com/news/stock-market-news/article-2267013
Мосбиржа расширит список доступных на вечерних торгах акций,"© Reuters.
Investing.com — Московская биржа сообщила об увеличении числа ценных бумаг, доступных для заключения сделок на вечерней торговой сессии на рынке акций. С 9 марта в список инструментов на вечерних торгах рынка акций будут добавлены 11 ценных бумаг.биржа об увеличении числа ценных бумаг, доступных для заключения сделок на вечерней торговой сессии на рынке акций. С 9 марта в список инструментов на вечерних торгах рынка акций будут добавлены 11 ценных бумаг. 
С 9 марта на вечерней сессии Мосбиржи станут доступны акции следующих компаний:
Кроме того, в список будут добавлены обыкновенные и привилегированные акции компании «Мечел».«Мечел» . 
В общей сложности, с 9 марта инвесторы смогут заключать сделки с 74 инструментами рынка акций — ценными бумагами российских эмитентов, БПИФ, а также паями ПИФ, сообщила торговая площадка. Кроме того, с 6 марта 2023 года на вечерних торгах для заключения сделок станет доступен ОПИФ «БКС Российские Акции».
Следите за нашими новостями в социальных сетях: Telegram, «ВКонтакте» и «Одноклассниках».
Текст подготовил Тимур Алиев","06.03.2023, 16:54",https://ru.investing.com/news/stock-market-news/article-2235975
Минстрой РФ планирует в 2024 году обеспечить нормативную базу для строительства деревянных домов,"Минстрой РФ планирует в 2024 году обеспечить нормативную базу для строительства деревянных домов

""Мы в этом году, я думаю, завершим полностью все испытания и, как минимум, обеспечим внесение изменений в нормативную базу в первом квартале 2024 года, обеспечим строительство пяти этажей. (...) Со следующего года дома из дерева, как минимум, высотой пять этажей у нас можно будет строить"", - сказал Музыченко в кулуарах форума ""Стратегии ускорения темпов строительства"" в Новосибирске. В частности, до конца текущего года министерству нужно решить вопросы, касающиеся пожарной и сейсмической безопасности.
Как сообщалось, Минстрой разрабатывает новые нормативные акты, позволяющие строить в России многоэтажные деревянные дома, с 2020 года.
В июле 2022 года Минстрой и МЧС РФ утвердили план мероприятий по развитию деревянного домостроения на период до 2024 года, который предусматривает как актуализацию имеющихся, так и разработку новых нормативно-технических документов для развития деревянного домостроения. Также документ предусматривает, в том числе, организацию совместной работы ведомств с АФК ""Система"", которой в числе прочих активов принадлежит лесопромышленный холдинг Segezha Group (MCX:SGZH).SGZH ).","14.02.2023, 11:36",https://ru.investing.com/news/economy/article-2226490
