Title,Text,Time,Url
ВТБ не планирует снижать долю во Вьетнамо-российском совместном банке,"© Reuters ВТБ не планирует снижать долю во Вьетнамо-российском совместном банке
Frankmedia - ВТБ (MCX:VTBR) пока не планирует снижать долю во Вьетнамо-российском совместном банке (ВРБ), пишет «Интерфакс» со ссылкой на слова главы ВТБ Андрея Костина.VTBR ) пока не планирует снижать долю во Вьетнамо-российском совместном банке (ВРБ), пишет «Интерфакс» со ссылкой на слова главы ВТБ Андрея Костина. 
«Будем развивать потихоньку. Он обслуживает фактически сейчас весь объем торговли в донгах и в рублях, это 40% экспортно-импортных операций. Будем дальше наращивать. У нас кредитный портфель больше полумиллиарда, порядка $520 млн. Примерно чуть больше корпоративные, чуть меньше розничные (кредиты — FM). Поэтому так будем работать сейчас. Нам просто долю снизили ниже 50%. Для этого вьетнамцы приняли специальное законодательство, так что мы им благодарны», — сказал Костин.
Вьетнамо-российский совместный банк создан ВТБ и Банком инвестиций и развития Вьетнама (BIDV). Учредители до последнего владели в нем равными долями — по 50% уставного капитала.
В декабре 2024 года в капитал банка зашла вьетнамская компания NGS Telecommunication and Equipment, получив 1%. Доли ВТБ и BIDV соответственно снизились до 49,5%. Телеком-оператор внес в капитал ВРБ $1,7 млн и, таким образом, у банка нет контролирующего акционера, либо владельца, чья доля оставляла бы 50%.
Читайте оригинальную статью на сайте Frankmedia","14.01.2025, 14:03",https://ru.investing.com/news/general/article-2621318
Крупные банки начали снижать ставки по вкладам — Frank RG,"© Reuters. Крупные банки начали снижать ставки по вкладам — Forbes со ссылкой на Frank RG
sMart-lab.ru - В конце декабря 2024-го — начале января 2025 года сразу 10 банков из двадцатки крупнейших по объему привлеченных средств населения снизили ставки по вкладам на различные сроки, следует из данных консалтинговой компании Frank RG, с которыми ознакомился Forbes.
В частности, ставки по вкладам пересмотрели ВТБ (MCX:VTBR), Альфа-банк, Газпромбанк, Т-Банк, МКБ (MCX:CBOM), РСХБ, банки «Дом.РФ», «Санкт-Петербург» и «Уралсиб», а также РНКБ. Из данных Frank RG следует, что самые большие изменения произошли в наиболее популярном и доходном сегменте — полугодовых вкладах.VTBR ), Альфа-банк, Газпромбанк, Т-Банк, МКБ (MCX: CBOM ), РСХБ, банки «Дом.РФ», «Санкт-Петербург» и «Уралсиб», а также РНКБ. Из данных Frank RG следует, что самые большие изменения произошли в наиболее популярном и доходном сегменте — полугодовых вкладах. 
Читайте оригинальную статью на сайте sMart-lab.ru","13.01.2025, 15:41",https://ru.investing.com/news/general/article-2619756
ВТБ взыскал £40 млн со счета бывшей британской дочки VTB Capital через суд,"© Reuters ВТБ взыскал £40 млн (₽5,05 млрд) со счета бывшей британской дочки VTB Capital через суд – РБК
sMart-lab.ru - В октябре 2024 года ВТБ (MCX:VTBR) списал £40 млн (5,05 млрд рублей) со счета бывшей дочерней компании VTB Capital, хранившегося в российском Национальном расчетном депозитарии (НРД). Это стало возможным после решения Арбитражного суда Санкт-Петербурга, удовлетворившего иск ВТБ о взыскании задолженности.VTBR ) списал £40 млн (5,05 млрд рублей) со счета бывшей дочерней компании VTB Capital, хранившегося в российском Национальном расчетном депозитарии (НРД). Это стало возможным после решения Арбитражного суда Санкт-Петербурга, удовлетворившего иск ВТБ о взыскании задолженности. 
VTB Capital, бывшая британская «дочка» госбанка, оказалась под внешним управлением в 2022 году из-за санкций Великобритании. По оценкам управляющей компании Teneo, совокупные долги инвестбанка составляют более £800 млн, из которых £262 млн приходится на структуры ВТБ.
Списание средств практически обнулило активы VTB Capital в России. ВТБ получил только 34,2% от требований к компании. Внешние управляющие считают, что перспективы возврата этих денег обратно в Великобританию минимальны.
Читайте оригинальную статью на сайте sMart-lab.ru","13.01.2025, 11:16",https://ru.investing.com/news/general/article-2619638
Банк «ФК Открытие» официально прекратил свое существование  ,"© Reuters. Банк “ФК Открытие” официально прекратил свое существование  
Frankmedia - Группа ВТБ (MCX:VTBR) провела реорганизацию кредитных организаций, присоединив банк “ФК Открытие” к БМ-банку (бывший Банк Москвы (MCX:MMBM), принадлежит ВТБ), следует из ЕГРЮЛ. В реестре отмечено, что банк ФК Открытие с 1 января 2025 года прекратил свою деятельность путем реорганизации в форме присоединения.VTBR ) провела реорганизацию кредитных организаций, присоединив банк “ФК Открытие” к БМ-банку (бывший Банк Москвы (MCX: MMBM ), принадлежит ВТБ), следует из ЕГРЮЛ. В реестре отмечено, что банк ФК Открытие с 1 января 2025 года прекратил свою деятельность путем реорганизации в форме присоединения. 
Планировалось, что в январе 2025 года клиенты «ФК Открытие», которые не вышли на связь в ходе процесса его интеграции в ВТБ, с 1 января 2025 года автоматически перейдут в БМ-банк. «Все средства на их счетах сохраняются, просто клиенты «Открытия» становятся клиентами БМ-банка. Потом, когда БМ-банк присоединится к ВТБ, они тоже станут клиентами ВТБ. Воспользоваться своими деньгами клиенты смогут в любой момент, когда сочтут необходимым», — сказал экс-президент «ФК Открытие» Михаил Алексеев.
Полномочия Алексеева были прекращены по соглашению сторон 31 декабря 2024 года, решение об этом было принято на заседании совета директоров кредитной организации. Тогда же из банка также ушли два заместителя председателя и три члена правления банка, их имена не раскрывались в сообщении кредитной организации.
Банк России закрыл сделку по продаже банка «ФК Открытие» госбанку в конце декабря 2022 года. Цена сделки составила 340 млрд рублей. Часть средств — 106,9 млрд рублей — ВТБ вносил в виде облигаций федерального займа (ОФЗ), другую — на 233 млрд рублей — в виде денежных средств. Также в ВТБ были передан весь объем розничных кредитов в размере 770 млрд рублей, и практически весь объем средств клиентов — 940 млрд рублей.
Изначально планировалось, что банк сдаст лицензию в 2024 году и запустит процесс добровольной ликвидации. Впоследствии ВТБ изменил стратегию интеграции. С начала 2024 года в офисах «Открытия» можно было оформить финансовые продукты ВТБ, в том числе дебетовые и кредитные карты. Объединение бизнесов двух банков должно было завершиться к концу прошлого года.
Читайте оригинальную статью на сайте Frankmedia","09.01.2025, 15:56",https://ru.investing.com/news/general/article-2617912
ВТБ оспаривает в суде отзыв лицензии европейской «дочки»,"© Reuters ВТБ оспаривает в суде отзыв лицензии европейской «дочки»
Frankmedia - ВТБ (MCX:VTBR) в октябре подал иск в суд Евросоюза, чтобы оспорить решение Европейского центрального банка (ЕЦБ) отозвать лицензию у германской «дочки» Ost-West Handelsbank (OWH SE, ранее VTB Bank Europe), сообщил «Интерфакс» со ссылкой на документы на официальном портале Европейского Союза. Банк просит признать решение недействительным.VTBR ) в октябре подал иск в суд Евросоюза, чтобы оспорить решение Европейского центрального банка (ЕЦБ) отозвать лицензию у германской «дочки» Ost-West Handelsbank (OWH SE, ранее VTB Bank Europe), сообщил «Интерфакс» со ссылкой на документы на официальном портале Европейского Союза. Банк просит признать решение недействительным. 
Российский банк пожаловался, что европейский регулятор решил ликвидировать немецкую «дочку» и подготовил решение об отзыве ее лицензии без консультаций с ним как с основным акционером OWH. Кроме того, ВТБ просит суд обязать ЕЦБ в рамках разбирательства предоставить доступ к соответствующим документам. По мнению ВТБ, решение о ликвидации банка было незаконным, а отзыв лицензии — нецелесообразным из-за временного характера санкций. Так, произошедшее нарушило соглашение о защите инвестиций, которые заключили Германия и СССР как юридический предшественник России в 1989 году, считают в банке.
Согласно сообщению на сайте OWH SE, его лицензия отозвана с 20 августа 2024 года в связи с решением о ликвидации кредитной организации, которое было принято еще в марте 2023 года на ежегодном общем собрании OWH. Кроме того, по мнению надзорного органа, ВТБ не относится к категории надежных акционеров с точки зрения банковского законодательства Германии.
«Отзыв банковской лицензии — это следующий шаг в продолжающейся ликвидации OWH. Это приносит значительное облегчение для завершения нашей повседневной работы, особенно в отношении наших нормативных обязательств», — заявлял тогда Франк Хеллвиг, специальный представитель Федерального управления финансового надзора Германии (BaFin) и один из ликвидаторов OWH.
«Отзыв банковской лицензии — это следующий шаг в продолжающейся ликвидации OWH. Это приносит значительное облегчение для завершения нашей повседневной работы, особенно в отношении наших нормативных обязательств», — заявлял тогда Франк Хеллвиг, специальный представитель Федерального управления финансового надзора Германии (BaFin) и один из ликвидаторов OWH.
На середину августа 2024 года объем кредитов на балансе OWH составлял 1,5 млрд евро, объем обязательств перед компаниями и кредитными организациями — 0,6 млрд евро. Возврат активов остается главной задачей банка даже после отзыва лицензии, сообщалось на сайте OWH.евро , объем обязательств перед компаниями и кредитными организациями — 0,6 млрд евро. Возврат активов остается главной задачей банка даже после отзыва лицензии, сообщалось на сайте OWH. 
Читайте оригинальную статью на сайте Frankmedia","09.01.2025, 08:25",https://ru.investing.com/news/general/article-2617544
Кто смог дать верный прогноз для непредсказуемого 2024 года,"Кто смог дать верный прогноз для непредсказуемого 2024 года
В течение 2024 года как российские, так и иностранные банки, регуляторы и чиновники размышляли над тем, чем же закончится этот год для российской экономики. Цифры роста ВВП, уровень ключевой ставки и доходы населения с безработицей не смог предугадать никто. Практически всем пришлось сильно корректировать свои расчеты и допущения. Frank Media собрал все прогнозы, чтобы понять, кто же точнее всего смог спрогнозировать исход года.
Одним из ключевых показателей для страны является показатель роста валового внутреннего продукта по итогам года.
Так, согласно последнему макроэкономическому опросу Банка России, который был опубликован 11 декабря, аналитики ожидали, что в текущем году ВВП России вырастет на 3,8%. При этом сам Центробанк в конце октября публиковал свой прогноз, из которого следовало, что регулятор ожидает роста ВВП на 3,5-4% по итогам года.
Минэкономразвития в сентябре предполагал, что рост ВВП страны в конце 2024 года будет составлять 3,9%. Солидарна с российским ведомством была и организация экономического сотрудничества и развития (ОЭСР), которая в декабре повысила прогноз по росту ВВП России с 3,7% до 3,9%.
Менее оптимистичный прогноз по этому показателю в конце октябре публиковал Международный валютный фонд (МВФ), который прогнозировал рост ВВП на уровне 3,6%. Еще хуже прогноз давала Европейская комиссия. Так, в середине ноября ЕК прогнозировала, что текущий год может завершиться тем, что ВВП вырастет только на 3,5%.
Меньше всего в рост экономики России верил Всемирный банк, который прогнозировал рост этого показателя по итогам года только на 3,2%.
Крупнейшие банки страны Сбербанк и ВТБ (MCX:VTBR) по вопросу роста ВВП за 2024 год сошлись в своих прогнозах – 3,8% каждый.VTBR ) по вопросу роста ВВП за 2024 год сошлись в своих прогнозах – 3,8% каждый. 
Такой же уровень прогнозировал и Центр макроэкономического анализа и краткосрочного прогнозирования (ЦМАКП) – 3,7-3,8%. Однако стоит отметить, что в феврале организация ожидала, что ВВП России к концу годы вырастет только на 1,7-2%.
В течение года существенно вырос и прогнозный диапазон ЦМАКП по инфляции. Так, в феврале текущего года экономисты ждали, что к концу года инфляция будет составлять 4-4,3%, в декабре прогноз организации вырос до 10,15 – 10,25%.
Близкие к этому уровню были ожидания и у аналитиков, опрошенных Банком России, — 9,2%. При этом сам регулятор ожидал, что к концу года инфляция будет находиться в диапазоне 8-8,5%.
На уровне 8,5% ожидал инфляцию и ВТБ. При этом ОЭСР была немного оптимистичней и ожидала, что инфляция в России достигнет значения 8,2%. А Еврокомиссия пошла чуть дальше и прогнозировала инфляцию на уровне 8,1%.
Главным оптимистом по уровню инфляции стал Минэкономразвития, который ожидал её на уровне 7,3%, а также Сбербанк, прогнозировавший, что рост индекса потребительских цен (ИПЦ) по итогам года составит 6,5 – 7,5%.
Однако годовая инфляция превысила 9% уже в период с 26 ноября по 2 декабря. После этого момента ниже она пока не опускалась. В последнюю неделю года Минэкономразвития опубликовал обзор, согласно которому годовая инфляция составила 9,7%.
Прогноз по ключевой ставке в 2024 году был особенно любимым развлечением аналитиков и экономистов. Аналитики, опрошенные ЦБ, предполагали в декабре, что на конец 2024 года ключевая ставка составит 21,5%. А медианный прогноз составлял 17,5%. При этом публично обсуждались совсем другие прогнозы.
Худшего исхода по ключевой ставке ждал ВТБ, который прогнозировал, что она в конце года будет на уровне 23%. Руководство Сбербанка (MCX:SBER) склонялось к такому же уровню.SBER ) склонялось к такому же уровню. 
В декабре из 48 экспертов, которые были опрошены авторами телеграм-канала «Холодный расчет», ключевую ставку на уровне 21% смог предсказать только шведский банк SEB. При этом 70% из опрошенных ожидали, что ставка будет повышена до 23%. ЦБ объяснял свое решение тем, что произошло более существенное ужесточение денежно-кредитных условий (ДКУ), даже существеннее, чем предполагало октябрьское решение по ключевой ставке. Этому способствовали автономные от денежно-кредитной политики (ДКП) факторы.
На пресс-конференции по решению по ключевой ставке председательница Банка России Эльвира Набиуллина, отвечая на вопрос о нарушении в коммуникации с рынком, заявила, что ""это действительно проблема"" и регулятор будет рассматривать возможные решения по улучшению этой ситуации. ""Мы принимаем решение исходя из нашей оценки ситуации и нашего прогноза. И в оценке этой ситуации мы в последнее время достаточно активно взаимодействовали и с банками, и реальным сектором экономики для того, чтобы понимать, что происходит в экономике. С точки зрения коммуникации мы будем смотреть, что здесь можно будет еще улучшить. Это действительно проблема коммуникации в наших решениях очень важна. Поэтому мы сейчас объясняем логику наших движений"", - отмечала Набиуллина.
Читайте оригинальную статью на сайте Frankmedia","29.12.2024, 11:08",https://ru.investing.com/news/general/article-2610331
