Title,Text,Time,Url
Инвестхолдинг SFI полностью погасил свой долг  ,"© Reuters. Инвестхолдинг SFI полностью погасил свой долг  
Frankmedia - Инвестиционный холдинг SFI («ЭсЭфАй») полностью погасил остаток задолженности в размере 9,7 млрд рублей по кредитному договору, сократив тем самым до нуля объем своих текущих кредитных обязательств, следует из сообщения компании.
Холдинг еще в декабре 2019 года открыл у банка ВТБ (MCX:VTBR) кредитную линию на 21 млрд рублей для финансирования обратного выкупа акций с биржи. На конец 2020 года долг перед ВТБ достиг почти 18 млрд рублей, однако затем постепенно снижался, в том числе за счет продажи холдингом активов, крупнейшим из которых был НПФ «Сафмар».VTBR ) кредитную линию на 21 млрд рублей для финансирования обратного выкупа акций с биржи. На конец 2020 года долг перед ВТБ достиг почти 18 млрд рублей, однако затем постепенно снижался, в том числе за счет продажи холдингом активов, крупнейшим из которых был НПФ «Сафмар». 
На конец третьего квартала 2021 года долг перед ВТБ составлял 13,7 млрд рублей. В ноябре 2021 холдинг реструктуризировал свой кредит в Совкомбанке, в котором SFI привлек средства до конца ноября 2024 года объемом 13,7 млрд рублей. В Совкомбанке была открыта не кредитная линия, а непосредственно кредит.
Заместитель генерального директора SFI Олег Андриянкин отметил, что «отсутствие кредитных обязательств на корпоративном центре должно позитивно сказаться на оценке холдинга рынком – инвесторами, аналитиками и рейтинговыми агентствами».
«ЭсЭфАй» был создан семьей российского бизнесмена Михаила Гуцериева в конце 2016 года. Сначала он объединял небанковские финансовые активы, но затем превратился в универсальный холдинг. На данный момент в него входит 87,5% акций лизинговой компании «Европлан», 49% страховой компании ВСК, а также 10,4% ритейлера «М.Видео (MCX:MVID)».MVID )». 
Читайте оригинальную статью на сайте Frankmedia","23.12.2024, 11:22",https://ru.investing.com/news/general/article-2607734
Британский суд одобрил распределение активов британской дочки ВТБ,"© Reuters Британский суд разрешил начать распределение активов британской дочки ВТБ
Frankmedia - Высокий суд Англии и Уэльса разрешил управляющим британского подразделения российского банка ВТБ (MCX:VTBR) — VTB Capital — приступить к распределению активов. Решение в начале декабря 2024 года вынес судья Адам Джонсон на закрытом заседании, следует из материалов дела, с которыми ознакомился Frank Media.VTBR ) — VTB Capital — приступить к распределению активов. Решение в начале декабря 2024 года вынес судья Адам Джонсон на закрытом заседании, следует из материалов дела, с которыми ознакомился Frank Media. 
Дело инициировали Стивен Роланд Браун и Дэвид Филип Соден — управляющие директора консалтинговой компании Teneo Financial Advisory, которая с апреля 2022 года управляет VTB Capital. Поводом для обращения в суд стал отказ основных кредиторов — банка ВТБ и компании NCH — утвердить предложенную управляющими схему распределения активов. Как указано в решении суда, 4 сентября 2024 года ВТБ и NCH проголосовали против схемы в ее текущем виде, воспользовавшись правом вето. Это привело к переносу собрания кредиторов на 30 января 2025 года, а слушание по утверждению схемы назначено на 6 февраля 2025 года. В то же время обсуждения с кредиторами, выступившими против, продолжаются.
Управляющие VTB Capital обратились в суд с просьбой разрешить начать распределение активов в обход утверждения схемы, чтобы применить механизм insolvency set-off (взаимозачет обязательств). Это позволит увеличить объем активов для общего пула кредиторов и защитить их интересы, минимизировав риски, связанные с действиями ВТБ. Судья напомнил, что ВТБ уже инициировал судебные процессы в России, направленные на взыскание активов VTB Capital, включая заблокированные средства в Национальном расчетном депозитарии (НРД). Из них около 40 млн фунтов стерлингов уже списаны в пользу ВТБ, а еще 17 млн остаются на счетах в виде наличных и ценных бумаг.
Судья отметил, что управляющие намерены распределить активы вне зависимости от исхода голосования. Если схема будет утверждена, распределение пройдет в рамках ее положений. Если же кредиторы не поддержат схему, активы будут распределены в соответствии с Insolvency Rules 2016 (правилами о несостоятельности). Таким образом, вопрос состоит лишь в выборе процедуры.
В качестве подтверждения неизбежности распределения судья напомнил, что в марте 2023 года управляющие представили план расчетов с кредиторами, предусматривающий распределение 175 млн фунтов стерлингов, и он не вызвал возражений. Кредиторы также не выступили против продления полномочий управляющих.
«Учитывая эти обстоятельства, я считаю правильным удовлетворить запрос управляющих», — говорится в решении суда. При этом судья установил условие: решение остается конфиденциальным до момента официального уведомления о начале распределения. Это необходимо, чтобы предотвратить возможные принудительные действия в России, которые могут помешать реализации плана.
Кроме того, разрешение предусматривает право любого кредитора оспорить распределение до его начала. Такая структура, по словам судьи, обеспечивает баланс между интересами всех кредиторов, которые выиграют от применения механизма взаимозачета, и правами отдельных кредиторов, желающих оспорить законность этого решения.
Frank Media направили запрос в Teneo и ВТБ.
Подразделение VTB Capital в Великобритании подало заявление в Высокий суд Лондона на переход под внешнее управление в апреле 2022 года. Банк мотивировал это решение невозможностью погасить свои долги из-за введенных в отношении него санкций, хотя известно, что он в принципе планировал его закрывать. В конце декабря того же года администрирование компании было передано Teneo. Teneo получила лицензии (в августе — от Минфина Бельгии, и в ноябре — от Минфина США — FM), чтобы реализовать замороженные активы подразделения, чтобы погасить долг перед кредиторами, не находящимся под санкциями. Администратор работает с властями стран-ЕС (Франции, Ирландии и Бельгии), а также Гернси, Джерси, Швейцарии, Кипра и на Бермудах.
Читайте оригинальную статью на сайте Frankmedia","17.12.2024, 19:05",https://ru.investing.com/news/general/article-2603289
Госбанки снова повысили ставки по депозитам накануне решения ЦБ,"© Пресс-служба банка ВТБ Госбанки снова повысили ставки по депозитам накануне решения ЦБ
Frankmedia - ВТБ (MCX:VTBR) и Сбербанк повысили ставки по депозитам перед решением ЦБ о ставке 20 декабря (текущая 21%). Таким образом, ВТБ с 17 декабря повысил ставки по вкладам на 3 месяца до 23,7% годовых, на 6 месяцев – до 24% годовых при выплате процентов в конце срока для всех сегментов, сообщил банк. Максимальная ставка доступна действующим клиентам, получающим зарплату или пенсию на карту банка, а также состоятельным клиентам.VTBR ) и Сбербанк повысили ставки по депозитам перед решением ЦБ о ставке 20 декабря (текущая 21%). Таким образом, ВТБ с 17 декабря повысил ставки по вкладам на 3 месяца до 23,7% годовых, на 6 месяцев – до 24% годовых при выплате процентов в конце срока для всех сегментов, сообщил банк. Максимальная ставка доступна действующим клиентам, получающим зарплату или пенсию на карту банка, а также состоятельным клиентам. 
«Мы ожидаем роста ключевой ставки на ближайшем заседании ЦБ, поэтому заблаговременно повышаем ставки по вкладам», – уточнил зампред правления ВТБ Георгий Горшков.
В Сбербанке (MCX:SBER) с 16 декабря приветственная ставка по накопительному счету составляет 18% годовых (было 16% годовых) в первые три месяца, свидетельствуют тарифы банка. С четвертого месяца ставка составит 10% годовых, но ее можно увеличить до 18% годовых если подключить платные подписки «СберПрайм/ СберПрайм+», за покупки от ₽5 тысяч в магазинах — партнерах банка, за траты по картам «Сбера» от 30 тысяч в месяц.SBER ) с 16 декабря приветственная ставка по накопительному счету составляет 18% годовых (было 16% годовых) в первые три месяца, свидетельствуют тарифы банка. С четвертого месяца ставка составит 10% годовых, но ее можно увеличить до 18% годовых если подключить платные подписки «СберПрайм/ СберПрайм+», за покупки от ₽5 тысяч в магазинах — партнерах банка, за траты по картам «Сбера» от 30 тысяч в месяц. 
По вкладу «СберВклад» максимальная процентная ставка достигает 22,5% годовых при открытии депозита на полгода и вложении от 1 млн с учетом всех надбавок. Для вкладов, сумма которых составляет до 1 млн рублей, максимальная доходность с учетом надбавок составит 22% годовых. Если подключить пакет «СберПремьер», ставка по вкладу «СберВклад» на полгода повысится до 23% годовых.
Индекс ставок по годовым вкладам и депозитам банков на сумму 100 тысяч рублей на 17 декабря составляет 17,74%, свидетельствуют данные индекса ставок FRG100.
Читайте оригинальную статью на сайте Frankmedia","17.12.2024, 09:14",https://ru.investing.com/news/general/article-2602510
Вывод средств с ИИС не распространится на купоны — Минфин,"© Reuters.
Investing.com — Послабления по выводу средств с ИИС не коснутся купонов по облигациям, заявил журналистам заместитель министра финансов Иван Чебесков в кулуарах Форума ВТБ «Россия зовет!». Его слова передает РБК.ВТБ «Россия зовет!». Его слова РБК. 
«Только дивиденды. Про купоны — у нас же действует налоговый вычет. То есть логика такая, если есть вычет, значит это можно, как говорится, оставлять в долгий срок. Если ты не хочешь получать вычет или не можешь, как по дивидендным вычетам, тогда должна быть возможность их вывести. Мы действуем в такой логике. Соответственно, подготовлен законопроект по дивидендам», — пояснил он.
«Только дивиденды. Про купоны — у нас же действует налоговый вычет. То есть логика такая, если есть вычет, значит это можно, как говорится, оставлять в долгий срок. Если ты не хочешь получать вычет или не можешь, как по дивидендным вычетам, тогда должна быть возможность их вывести. Мы действуем в такой логике. Соответственно, подготовлен законопроект по дивидендам», — пояснил он.
Накануне президент России Владимир Путин предложил разрешить вывод дивидендов с ИИС-3 на другие счета. Сейчас дивиденды и купоны по ИИС-3 не могут выводиться на счета, отличные от ИИС.предложил разрешить вывод дивидендов с ИИС-3 на другие счета. Сейчас дивиденды и купоны по ИИС-3 не могут выводиться на счета, отличные от ИИС. 
«Предлагаю дополнить функционал этого инструмента, сделать так, чтобы инвестор мог выбрать счет для зачисления дивидендов по акциям, учтенным на индивидуальных инвестсчетах, то есть мог использовать полученный доход по своему усмотрению и что важно — в любое время», — сказал Путин.
«Предлагаю дополнить функционал этого инструмента, сделать так, чтобы инвестор мог выбрать счет для зачисления дивидендов по акциям, учтенным на индивидуальных инвестсчетах, то есть мог использовать полученный доход по своему усмотрению и что важно — в любое время», — сказал Путин.","05.12.2024, 14:41",https://ru.investing.com/news/general/article-2591624
