Title,Text,Time,Url
"Инвестпрограмма ""МРСК Урала"" в 2022 году увеличилась на 6,8%","Инвестпрограмма ""МРСК Урала"" в 2022 году увеличилась на 6,8%

В отчете ""МРСК Урала"" за 2021 год говорится, что она вложила в инвестиционную программу около 13,5 млрд рублей, таким образом, рост показателя в 2022 году составил 6,8%.
В сообщении отмечается, что в 2022 году компания направила 5,1 млрд рублей на ремонт и эксплуатацию электросетевого комплекса, консолидировала более 7,3 тыс. единиц оборудования, выполнила более 30 тыс. договоров технологического присоединения.
ОАО ""МРСК Урала"" - единая операционная компания Уральского региона, осуществляющая распределение электроэнергии на территории Свердловской и Челябинской областей, а также Пермского края.","27.01.2023, 16:04",https://ru.investing.com/news/economy/article-2219166
"""МРСК Урала"" 29 декабря досрочно погасит бонды БО-05 на 5 млрд рублей","""МРСК Урала"" 29 декабря досрочно погасит бонды БО-05 на 5 млрд рублей
ОАО ""МРСК Урала (MCX:MRKU)"" приняло решение 29 декабря досрочно погасить облигации серии БО-05 объемом 5 млрд рублей, говорится в сообщении компании.MRKU )"" приняло решение 29 декабря досрочно погасить облигации серии БО-05 объемом 5 млрд рублей, говорится в сообщении компании. 

Компания в августе 2016 года разместила выпуск 10-летних облигаций серии БО-05 на 5 млрд рублей. Ставка полугодовых купонов установлена на уровне 9,32% годовых до погашения.

В августе 2019 года компания выкупила по оферте весь выпуск облигаций.

В настоящее время в обращении находятся 3 выпуска биржевых облигаций компании на 12 млрд рублей.

ОАО ""МРСК Урала"" - единая операционная компания Уральского региона, осуществляющая распределение электроэнергии на территории Свердловской и Челябинской областей, а также Пермского края.","26.12.2022, 10:49",https://ru.investing.com/news/economy/article-2211645
"""МРСК Урала"" 15 ноября досрочно погасит бонды БО-02 на 1,6 млрд рублей","""МРСК Урала"" 15 ноября досрочно погасит бонды БО-02 на 1,6 млрд рублей
ОАО ""МРСК Урала (MCX:MRKU)"" приняло решение 15 ноября досрочно погасить облигации серии БО-02 объемом 1,6 млрд рублей, говорится в сообщении компании.MRKU )"" приняло решение 15 ноября досрочно погасить облигации серии БО-02 объемом 1,6 млрд рублей, говорится в сообщении компании. 

Погашение состоится в дату окончания 14-го купонного периода.

В ноябре 2019 года компания выкупила по оферте весь выпуск облигаций.

Компания в конце ноября 2015 года завершила размещение 10-летних облигаций серии БО-02 номинальным объемом 3 млрд рублей, реализовав 53,33% выпуска на сумму 1,6 млрд рублей. Ставка 1-14-го купонов установлена на уровне 11,58% годовых до оферты с исполнением 18 ноября 2022 года.

В настоящее время в обращении находятся 4 выпуска биржевых облигаций компании на 13,6 млрд рублей.

ОАО ""МРСК Урала"" - единая операционная компания Уральского региона, осуществляющая распределение электроэнергии на территории Свердловской и Челябинской областей, а также Пермского края.","03.11.2022, 14:40",https://ru.investing.com/news/economy/article-2196223
"Во втором квартале ""МРСК Урала"" снизила чистую прибыль по МСФО в 2,3 раза","Во втором квартале ""МРСК Урала"" снизила чистую прибыль по МСФО в 2,3 раза

Выручка за 2-й квартал выросла на 5%, составив 22,864 млрд рублей.
Операционные расходы выросли на 3,8%, до 21,5 млрд рублей. Показатель EBITDA составил 4,3 млрд рублей (сокращение на 22,2%).
Чистая прибыль компании в I полугодии составила 3,127 млрд рублей, она на 23% меньше по сравнению с показателем аналогичного периода прошлого года. Выручка за 6 месяцев выросла на 4%, до 49,565 млрд рублей, операционные расходы - на 3%, до 45,88 млрд рублей.
Полугодовой показатель EBITDA составил 9,4 млрд рублей сокращение на 2,2%).
ОАО ""МРСК Урала"" - единая операционная компания уральского региона, осуществляющая распределение электроэнергии на территории Свердловской и Челябинской областей, а также Пермского края.","29.08.2022, 09:25",https://ru.investing.com/news/economy/article-2178431
"""Эксперт РА"" подтвердило рейтинг ""МРСК Урала"" на уровне ""ruAA"" со стабильным прогнозом","""Эксперт РА"" подтвердило рейтинг ""МРСК Урала"" на уровне ""ruAA"" со стабильным прогнозом
Рейтинговое агентство ""Эксперт РА"" подтвердило рейтинг кредитоспособности ОАО ""МРСК Урала"" (MOEX: MCX:MRKU) (""Россети (MCX:RSTI) Урал"", входит в группу ""Россети"" (MOEX: RSTI) ) на уровне ""ruAA"", прогноз рейтинга - ""стабильный"", сообщается в пресс-релизе агентства.MRKU ) (""Россети (MCX: RSTI ) Урал"", входит в группу ""Россети"" (MOEX: RSTI) ) на уровне ""ruAA"", прогноз рейтинга - ""стабильный"", сообщается в пресс-релизе агентства. 

Риск-профиль отрасли компании оценивается агентством как сильный: уровень просроченной задолженности перед кредитными организациями в электросетевой отрасли ниже среднерыночного уровня, устойчивость электросетевого бизнеса к внешним шокам высокая.

По расчетам агентства, отношение долга к EBITDA на 31 декабря 2021 года (""отчетная дата"") уменьшилось и составило 1,9х (2,6х на дату 31 декабря 2020). ""Падение коэффициента было обусловлено ростом EBITDA на фоне увеличения выручки в результате восстановления потребления электроэнергии и индексации тарифов на передачу электроэнергии"", - считает агентство.

Низкий уровень процентной нагрузки оказывает поддержку рейтингу: на отчетную дату покрытие процентных платежей показателем EBITDA составило около 6,3х. В ближайшей перспективе агентство ожидает увеличения процентной нагрузки в результате значительного роста ключевой ставки ЦБ РФ и соответствующего подъема рыночных ставок, компанией рассматриваются варианты сокращения объемов производственной и инвестиционной программ с целью снижения долговой нагрузки.

Агентство отмечает, что поддержку уровню рейтинга оказывает прогнозная ликвидность компании: операционный денежный поток на горизонте года от отчетной даты с учетом остатка денежных средств и невыбранных кредитных линий полностью покрывает плановые платежи по долгу, поддерживающие капитальные затраты и капитальные затраты на развитие, выплату дивидендов, однако без учета невыбранных кредитных линий операционный денежный поток является недостаточным для осуществления вышеперечисленных платежей.

Качественная оценка ликвидности позитивно оценивается агентством, несмотря на наличие пика погашений в ближайшие несколько лет, поскольку, по мнению агентства, задолженность будет рефинансирована.

Агентство допускает незначительное ухудшение показателей рентабельности на фоне возможного падения полезного отпуска и инфляции себестоимости в краткосрочной перспективе.

В настоящее время в обращении находится 4 выпуска биржевых облигаций компании на 13,6 млрд рублей.

ОАО ""МРСК Урала"" - единая операционная компания Уральского региона, осуществляющая распределение электроэнергии на территории Свердловской и Челябинской областей, а также Пермского края.","25.03.2022, 13:32",https://ru.investing.com/news/economy/article-2144565
